project_url,comment,created_at,comment_id
https://www.kickstarter.com/projects/cokercoop/outcasts-of-jupiter-1,Glad you made it and look forward to reading it,1400499805,UHJvamVjdENvbW1lbnQtNjc5ODU1Nw==
https://www.kickstarter.com/projects/cokercoop/outcasts-of-jupiter-1,"@Orson, Too true, I've had a Venture Bros. shirt that's lasted about  6 years now and I LOVE it !

@ Caleb, don't jinx it, ha!

- Shobo",1400339391,UHJvamVjdENvbW1lbnQtNjc5MDMwMw==
https://www.kickstarter.com/projects/cokercoop/outcasts-of-jupiter-1,You guys are going to get to 15k!!!,1400326826,UHJvamVjdENvbW1lbnQtNjc4OTY0OQ==
https://www.kickstarter.com/projects/cokercoop/outcasts-of-jupiter-1,"Better paper(or t-shirts) may not be as flashy as a new item or extra pre-existing things, but it's something you definitely appreciate once you have it in hand! :3",1400313959,UHJvamVjdENvbW1lbnQtNjc4OTE3MQ==
https://www.kickstarter.com/projects/cokercoop/outcasts-of-jupiter-1,"Hullo Mikhail! I think 14K would be mighty impressive, let alone $15! We're not really going to add new stretch goals this late though, mainly because if we do it would be artificial since they wouldn't be planned. We'd hoped we'd be able to add the coin, which is why we did, but any additional money we ear will go toward making the rewards even higher quality. Better paper, T-shirts, etc!",1400297506,UHJvamVjdENvbW1lbnQtNjc4ODIzNg==
https://www.kickstarter.com/projects/cokercoop/outcasts-of-jupiter-1,"Let's hope you guys hit 15,000. A new stretch goal if possible before final countdown.",1400285059,UHJvamVjdENvbW1lbnQtNjc4NzIwOQ==
https://www.kickstarter.com/projects/cokercoop/outcasts-of-jupiter-1,No means yes! We're gonna be flippin coins in December! I propose that heads mean stories about our sibs and tails mean even more stories,1400229281,UHJvamVjdENvbW1lbnQtNjc4MTkwNQ==
https://www.kickstarter.com/projects/cokercoop/outcasts-of-jupiter-1,"Woohoo, thanks everyone! We just met the stretch goal. Everyone that has pledged $15 and above now gets a 1 Sestertius brass coin, straight from the City of Seven Faces!",1400206860,UHJvamVjdENvbW1lbnQtNjc4MDM4OA==
https://www.kickstarter.com/projects/cokercoop/outcasts-of-jupiter-1,@Jonathan- Yes! The brass coin (Sestertius) starts at $15 if we meet the stretch goal,1400145726,UHJvamVjdENvbW1lbnQtNjc3NDYxNA==
https://www.kickstarter.com/projects/cokercoop/outcasts-of-jupiter-1,"@ Mikhail - Feels good!

@ Robert, thanks! We can't wait to get it out to everyone :D

- Shobo",1399775733,UHJvamVjdENvbW1lbnQtNjc0Mzg2Mw==
https://www.kickstarter.com/projects/1485353177/cella-redefine-urban-nature,"I love the idea. With so many 3d printers out there these days what about doing something so people could print their own. Selling blue prints, etc",1399749048,UHJvamVjdENvbW1lbnQtNjc0MTgxNA==
https://www.kickstarter.com/projects/1485353177/cella-redefine-urban-nature,"Having a successful kickstarter is what we need to be able to replicate the nice examples they have shown, rather than dwelling on not being able to replicate them with kickstarter rewards alone. :-)",1398972506,UHJvamVjdENvbW1lbnQtNjY2NTQ0MA==
https://www.kickstarter.com/projects/1485353177/cella-redefine-urban-nature,"I think it is quite natural that they want to show off what can be done with many Cella. They also said that the kickstarter funds would let them lower production costs, and therefore bring the pricing down.",1398972296,UHJvamVjdENvbW1lbnQtNjY2NTQxMA==
https://www.kickstarter.com/projects/1485353177/cella-redefine-urban-nature,I think the biggest problem is that the creators haven't quite worked out what scale they are aiming for. The reward levels and pricing are all about having a few Cella (less than ten) whereas the advertising photography is all about having lots of Cella (many tens if not thousands!). Either they need to drop the price to make a pack of ten or twenty affordable or they need to start selling what can be done with just one or two Cella.,1398948390,UHJvamVjdENvbW1lbnQtNjY2MjY0NQ==
https://www.kickstarter.com/projects/1485353177/cella-redefine-urban-nature,I just increased my pledge. Surely we can make this happen!,1398720290,UHJvamVjdENvbW1lbnQtNjYzOTg5NA==
https://www.kickstarter.com/projects/1485353177/cella-redefine-urban-nature,"This is actually an amazing project. I agree with Lukas though on the fact funding the hugh goal. From what I can see most backers chose either the 25 or the 50$ reward level, which would mean getting a total amount of at least 1000 to 2000 backers.
So my question is, if this kickstarter ever fails, would you still be able to sell small production pieces through an e-shop, while you look around for new ways to fund ? I would also hate that product not make it to the market, for I'm positively sure it would be a hit if it did.",1398708730,UHJvamVjdENvbW1lbnQtNjYzODE2OA==
https://www.kickstarter.com/projects/1485353177/cella-redefine-urban-nature,"This might be useful! https://m.facebook.com/story.php?story_fbid=307845826031478&id=100004181889304
I love what your doing! It's thyme we were more dynamic with our living environments!",1398456856,UHJvamVjdENvbW1lbnQtNjYyMDMxMw==
https://www.kickstarter.com/projects/1485353177/cella-redefine-urban-nature,"Thanks Lukas, your advice is very much appreciated! We are actually looking into urban design blogs at the moment, so hopefully we'll reach out to more people through that. Nevertheless, if you could also share our project among your friends, that would be great!",1398219700,UHJvamVjdENvbW1lbnQtNjU5NDA0Mw==
https://www.kickstarter.com/projects/1485353177/cella-redefine-urban-nature,I love this idea. I wonder if you've reached out to any blogs or the like that may cover your Kickstarter? For something with your pledge level sizes and your high goal it will be very difficult to get funded on backer word of mouth alone. I'd hate to see this product not make it to market.,1398195566,UHJvamVjdENvbW1lbnQtNjU5MDg4Mg==
https://www.kickstarter.com/projects/1485353177/cella-redefine-urban-nature,"I quite like this project, and I hope to be able to decorate my home with these comforting cella's. :-)",1398124613,UHJvamVjdENvbW1lbnQtNjU4MzE2Nw==
https://www.kickstarter.com/projects/1485353177/cella-redefine-urban-nature,"At the moment, yes. However, if we get enough funding from this Kickstarter project, we will upgrade our facilities so that we can efficiently produce more Cella, driving the cost down considerably. We want to make Cella affordable for everyone!

Cella is made from durable, slightly flexible plastic, so a breeze bumping them around would not be a problem at all.",1397661923,UHJvamVjdENvbW1lbnQtNjUzMTY0OQ==
https://www.kickstarter.com/projects/1485353177/cella-redefine-urban-nature,"Hmm, so create one of those funky indoor gardens one is looking at $1000 to $2000 worth of Cella? Ooof!

One more question, do you have any thoughts on how durable or fragile the Cella are? I'm thinking of hanging a bunch of them on threads from the ceiling, possibly in front of a window. If they were blowing in a breeze and bumping into each other and/or the window, would that be a problem?

Thanks.",1397471914,UHJvamVjdENvbW1lbnQtNjUwNDM2Mw==
https://www.kickstarter.com/projects/1485353177/cella-redefine-urban-nature,These look really great!  I'm always a fan for anything green!,1397411625,UHJvamVjdENvbW1lbnQtNjQ5OTI0NA==
https://www.kickstarter.com/projects/1485353177/cella-redefine-urban-nature,"Hi Paul, thank you for your contribution! We are excited to already have so many people interested in our product.",1397221067,UHJvamVjdENvbW1lbnQtNjQ4MDg3Mw==
https://www.kickstarter.com/projects/1485353177/cella-redefine-urban-nature,"Hi Hendrik, 
Yes, you are correct. We have not decided on colors for the limited edition Cella yet, but will update all our backers once we do. There's roughly 150-170 Cella in that indoor garden photo. For one square meter of garden, you need about 250 mixed sizes of Cella.

In the video, we used strong adhesive tape to attach the Cella to the wall. We recommend that you use a stronger adhesive, however, if you wish to create a permanent fixture on the wall.

Please let us know if you have any other questions. We will be adding some FAQ's soon.",1397220728,UHJvamVjdENvbW1lbnQtNjQ4MDgzNA==
https://www.kickstarter.com/projects/1485353177/cella-redefine-urban-nature,I'm glad to back this amazing project.,1397184960,UHJvamVjdENvbW1lbnQtNjQ3Nzc3Ng==
https://www.kickstarter.com/projects/1485353177/cella-redefine-urban-nature,"Hello. Cool product :).

Just to be absolutely clear, the $95 level includes 12 individual Cella (of which three are a different colour) and the $150 level includes 18 Cella (of which three are a different colour and three come pre-mossed)? What colour are the limited edition ones?

Also, how many Cella are used in the indoor garden pictures? E.g. the round garden in front of the wood stove? And how does the woman in the video manage to attach the Cella to the wall simply by pushing them on?

Thanks.",1397051438,UHJvamVjdENvbW1lbnQtNjQ1NTUzMQ==
https://www.kickstarter.com/projects/customgamelab/custom-game-dice-you-design,"KS advise is to hire an attorney to do the dirty work. The help from any U.S. backer is really appreciated. John Warren can't flee. In my country, backers joined to go to court with the ""Heroquest 25th anniversary"" case, legal procedures already began.",1557662681,UHJvamVjdENvbW1lbnQtMjQxMzc3MjI=
https://www.kickstarter.com/projects/customgamelab/custom-game-dice-you-design,"Said it countless times...not a fan of big government action, but Kickstarter needs to be hit, and hit HARD, for the amount out of outright fraud they allow .",1557371657,UHJvamVjdENvbW1lbnQtMjQxMDAwOTU=
https://www.kickstarter.com/projects/customgamelab/custom-game-dice-you-design,"I just submitted a Kickstarter support request with the text below. Feel free to copy and edit it to submit your own.

I am a backer of ""Custom Game Dice - You Design"" (https://www.kickstarter.com/projects/customgamelab/custom-game-dice-you-design) where a man named John Warren (under the name ""Custom Game Lab"") stole a total of $76,901 from 2,048 people (including $30 from me) using Kickstarter, and paying his Kickstarter fees with stolen money.
John Warren has gone unpunished for 5 years, because while Kickstarter happily accepted $3845.05 in stolen funds from John, they wont lift a finger to help his victims.
Help John's victims get justice. Kickstarter has done many great things in the last 10 years, but aiding and abetting fraudsters is not one of them.",1557148600,UHJvamVjdENvbW1lbnQtMjQwNjIzOTk=
https://www.kickstarter.com/projects/customgamelab/custom-game-dice-you-design,"10th anniversary of KS and 5th anniversary of John Warren's shameful KS. Although KS is not helping us, John Warren is responsible of this ""hit and run"" that stole our money. Every help from U.S. backers is welcomed. Let's bring John Warren.

In case this may help...
YOU DO NOT HAVE TO LIVE IN THE UNITED STATES OR IDAHO TO FILE A COMPLAINT
File a review or complaint with the Better Business Bureau (BBB).
FBI Internet Crime Complaint Center https://www.ic3.gov/default.aspx
File a complaint with the Idaho Attorney General. You might also considering filing with your own state’s attorney general as well if you haven’t done so. http://www.ag.idaho.gov/onlineForms/consumerProtectionComplaint.htm
File a complaint with the Federal Trade Commission. https://www.ftccomplaintassistant.gov/GettingStarted#crnt",1556632454,UHJvamVjdENvbW1lbnQtMjM5OTI4NTM=
https://www.kickstarter.com/projects/customgamelab/custom-game-dice-you-design,No 100 dice - No $125 = :(,1555596721,UHJvamVjdENvbW1lbnQtMjM4NjUxNTE=
https://www.kickstarter.com/projects/customgamelab/custom-game-dice-you-design,It’s okay. Little Lord Cartigan said John Wareen is not a scammer or thief? Wonder where he is to tell us so these days?,1552795071,UHJvamVjdENvbW1lbnQtMjM1MjgwNTM=
https://www.kickstarter.com/projects/customgamelab/custom-game-dice-you-design,Refund plz,1552758245,UHJvamVjdENvbW1lbnQtMjM1MjUzMjY=
https://www.kickstarter.com/projects/customgamelab/custom-game-dice-you-design,Warren...still a thief.,1552232303,UHJvamVjdENvbW1lbnQtMjM0NjMyNTU=
https://www.kickstarter.com/projects/customgamelab/custom-game-dice-you-design,"I've backed over 800 KS since this one, my very first ($54). 

Thankfully, most do a conscientious job with theirs.",1552158800,UHJvamVjdENvbW1lbnQtMjM0NTY5ODg=
https://www.kickstarter.com/projects/customgamelab/custom-game-dice-you-design,"Let's keep an eye on John Warren, our refunds are still pending.

In case this may help...
YOU DO NOT HAVE TO LIVE IN THE UNITED STATES OR IDAHO TO FILE A COMPLAINT
File a review or complaint with the Better Business Bureau (BBB).
FBI Internet Crime Complaint Center https://www.ic3.gov/default.aspx
File a complaint with the Idaho Attorney General. You might also considering filing with your own state’s attorney general as well if you haven’t done so. http://www.ag.idaho.gov/onlineForms/consumerProtectionComplaint.htm
File a complaint with the Federal Trade Commission. https://www.ftccomplaintassistant.gov/GettingStarted#crnt",1550622595,UHJvamVjdENvbW1lbnQtMjMyNjQ3NjA=
https://www.kickstarter.com/projects/customgamelab/custom-game-dice-you-design,Got it: https://web.archive.org/web/20150113001211/http://customgamelab.com/forum/,1550175265,UHJvamVjdENvbW1lbnQtMjMyMTgyNjM=
https://www.kickstarter.com/projects/customgamelab/custom-game-dice-you-design,"I know this campaign is old and withered.  I certainly don't expect to any custom-designed dice, and I hate to say it but it's not worth the effort to get my $12 back.  

That being said, I contributed quite a bit to the discussion forum about possible dice designs.  That site is long gone, but I'd like to see if the Internet Archive (Wayback Machine) has a record of any of the messages contributed to that forum.  

Does anyone remember the URL to the discussion forum?",1550159953,UHJvamVjdENvbW1lbnQtMjMyMTU1OTI=
https://www.kickstarter.com/projects/customgamelab/custom-game-dice-you-design,"While I sadly have funded way more than two projects that resulted in missing creators and no results, this one has been my most costly.  I still have hopes that one of John's other jobs will pan out enough that he can pay back those of us who didn't simply forgive his debt with a blessing.",1549752501,UHJvamVjdENvbW1lbnQtMjMxNjY2NjM=
https://www.kickstarter.com/projects/customgamelab/custom-game-dice-you-design,Just here to wave 'hello' to fellow backers of my first (of so far two) scam KS campaigns.,1549563173,UHJvamVjdENvbW1lbnQtMjMxMzk3NzQ=
https://www.kickstarter.com/projects/customgamelab/custom-game-dice-you-design,"Legacy Distribution (jr@brandingblitz.com), a.k.a. John Warren, has cancelled the refund request I made via paypal.
Let us know if any of you filed a complain as explained below...

YOU DO NOT HAVE TO LIVE IN THE UNITED STATES OR IDAHO TO FILE A COMPLAINT
File a review or complaint with the Better Business Bureau (BBB).
FBI Internet Crime Complaint Center https://www.ic3.gov/default.aspx
File a complaint with the Idaho Attorney General. You might also considering filing with your own state’s attorney general as well if you haven’t done so. http://www.ag.idaho.gov/onlineForms/consumerProtectionComplaint.htm
File a complaint with the Federal Trade Commission. https://www.ftccomplaintassistant.gov/GettingStarted#crnt",1549441862,UHJvamVjdENvbW1lbnQtMjMxMjEzMTQ=
https://www.kickstarter.com/projects/customgamelab/custom-game-dice-you-design,Quick update: John Warren is still an unethical jagazz who is likely raising his kids to be grifters.,1549082516,UHJvamVjdENvbW1lbnQtMjMwODE5OTM=
https://www.kickstarter.com/projects/customgamelab/custom-game-dice-you-design,"Requesting some help from backers...
I copy and paste here a text that I found on other KS project, about how to file a review or complaint with the Better Business Bureau (BBB)...

YOU DO NOT HAVE TO LIVE IN THE UNITED STATES OR IDAHO TO FILE A COMPLAINT
File a review or complaint with the Better Business Bureau (BBB).
FBI Internet Crime Complaint Center https://www.ic3.gov/default.aspx
File a complaint with the Idaho Attorney General. You might also considering filing with your own state’s attorney general as well if you haven’t done so. http://www.ag.idaho.gov/onlineForms/consumerProtectionComplaint.htm
File a complaint with the Federal Trade Commission. https://www.ftccomplaintassistant.gov/GettingStarted#crnt",1546379717,UHJvamVjdENvbW1lbnQtMjI3OTQ0NDA=
https://www.kickstarter.com/projects/customgamelab/custom-game-dice-you-design,"US backers should look into taking legal action, because somehow John thinks he got away with this.
A case about an unfulfilled and not refunded KS...
https://www.ftc.gov/news-events/press-releases/2015/06/crowdfunding-project-creator-settles-ftc-charges-deception",1545992052,UHJvamVjdENvbW1lbnQtMjI3Njk2NTc=
https://www.kickstarter.com/projects/customgamelab/custom-game-dice-you-design,John Warren....the worst example of a Christian I can think of.,1545969930,UHJvamVjdENvbW1lbnQtMjI3NjgxNDE=
https://www.kickstarter.com/projects/customgamelab/custom-game-dice-you-design,"Merry Christmas, Late Kickstarter!",1545678397,UHJvamVjdENvbW1lbnQtMjI3NDQ3NjM=
https://www.kickstarter.com/projects/customgamelab/custom-game-dice-you-design,"Tomorrow we celebrate the birth of Christ, the one who will enact the final judgement on thieving John Warren. Amen.",1545638285,UHJvamVjdENvbW1lbnQtMjI3NDEwNDg=
https://www.kickstarter.com/projects/customgamelab/custom-game-dice-you-design,"Backers and attorneys in U.S. are the ones able to reach John Warren. We can stay vigilant in the Internet searching John Warren, but actual action has to be taken. The help of any Christian community is also welcomed.",1544190843,UHJvamVjdENvbW1lbnQtMjI1NDQwMjE=
https://www.kickstarter.com/projects/customgamelab/custom-game-dice-you-design,@John Snyder: that fast people search website you link to below has his old address.  John moved to Idaho.,1544063182,UHJvamVjdENvbW1lbnQtMjI1MjIyMDY=
https://www.kickstarter.com/projects/customgamelab/custom-game-dice-you-design,"At this point he may already have his baby helping with the family business..perhaps as a lookout at the family excursion to Walmart for some shoplifting...in Christ's name, of course.",1542366326,UHJvamVjdENvbW1lbnQtMjIyOTQ0OTQ=
https://www.kickstarter.com/projects/customgamelab/custom-game-dice-you-design,Oh 3-year anniversary of failed refund is right around the corner.,1541937118,UHJvamVjdENvbW1lbnQtMjIyMjU4MjM=
https://www.kickstarter.com/projects/squeezableskyline/squeezable-skyline-the-original-huggable-highrise,"@Luke Aquilina:

Thanks for the support Luke!",1397315139,UHJvamVjdENvbW1lbnQtNjQ5MjA2Mg==
https://www.kickstarter.com/projects/squeezableskyline/squeezable-skyline-the-original-huggable-highrise,This is hilarious and looks pretty damn cozy. I bought one immediately. Of course.,1397262558,UHJvamVjdENvbW1lbnQtNjQ4ODM3NA==
https://www.kickstarter.com/projects/filastine/requiem-a-disorientalist-gothic-western-videoclip,I dig your style. Backed and shared!,1397281678,UHJvamVjdENvbW1lbnQtNjQ4OTg0NQ==
https://www.kickstarter.com/projects/1299225771/unknown-1-6-player-cooperative-boardgame,David: I'll message you so we can figure it out.,1478352401,UHJvamVjdENvbW1lbnQtMTQ4ODQ0MjM=
https://www.kickstarter.com/projects/1299225771/unknown-1-6-player-cooperative-boardgame,I never got my copy of the game as a backer. Any idea what I can do?,1478316857,UHJvamVjdENvbW1lbnQtMTQ4ODE1NDQ=
https://www.kickstarter.com/projects/1299225771/unknown-1-6-player-cooperative-boardgame,"Michelle:  Those are important, no ammo or barriers could make for an interesting game!  We will send you replacements today.  In the meantime, there are a few proxy tokens in the punchboard sheets that might help.",1473776374,UHJvamVjdENvbW1lbnQtMTQzODk3Njc=
https://www.kickstarter.com/projects/1299225771/unknown-1-6-player-cooperative-boardgame,Just unboxed my game and missing the red and black squares. Any way to get my hands on them or are they not that important? Don't know as we haven't started trying to play yet...,1473623143,UHJvamVjdENvbW1lbnQtMTQzNzQ5MDg=
https://www.kickstarter.com/projects/1299225771/unknown-1-6-player-cooperative-boardgame,"Timster80: We made it hard on purpose, but the goal is that you feel like you are always just a couple turns from losing, not continually hopeless.  Don't be afraid to tune the difficulty to your liking and then make it harder later once you have some wins under your belt.  If enemies are a particular problem but you want the same overall difficulty, use one less enemy and 4 more hazards.  I would definitely suggest starting with at least 3 survivors, the 2 survivor variant is balanced mathematically, but requires you to worry a lot more about positioning and timing.  Also make sure that you're not using the Elite enemy tiles.  Again, they are balanced, but can require strategies that you may not have picked up yet.",1467830086,UHJvamVjdENvbW1lbnQtMTM4MzQyNzc=
https://www.kickstarter.com/projects/1299225771/unknown-1-6-player-cooperative-boardgame,"I played it four times now - and had to give up every single time. It's pretty hard. Okay, I played alone today, with two survivors, and missed that both characters get two additional AP and an armor. But there were so many enemies and two spawn pits, I had no chance at all. Especially without enough ammo.",1467747402,UHJvamVjdENvbW1lbnQtMTM4MjE0Mzk=
https://www.kickstarter.com/projects/1299225771/unknown-1-6-player-cooperative-boardgame,"Awesome!! We played our first game last night and were impressed with the gameplay. The game was very atmospheric, simple to play and learn, yet complex in its strategy. It's very fast paced and every aspect of it is well thought through, starting from the graphics, the box, every single component, gameplay, missions, etc. I just hope we will be able to survive in the future: We were playing a Difficulty 2 rating and had our hands full with blazes close to our base, a brute chasing us around and food running low! Very much looking forward to playing more! Wonderful game! I hope there will be an expansion! Thanks a lot for all the effort you put into this!",1465728991,UHJvamVjdENvbW1lbnQtMTM2MDkyODc=
https://www.kickstarter.com/projects/1299225771/unknown-1-6-player-cooperative-boardgame,I just got mine. Very excited! Going to spend the evening unboxing and then have a game night tomorrow night. Thanks a lot for all the effort you put into this! Kudos!,1465576137,UHJvamVjdENvbW1lbnQtMTM1OTYxOTY=
https://www.kickstarter.com/projects/1299225771/unknown-1-6-player-cooperative-boardgame,"Received today, here in the UK. Looking forward to unboxing & playing. Thanks.",1465559522,UHJvamVjdENvbW1lbnQtMTM1OTMzNTE=
https://www.kickstarter.com/projects/1299225771/unknown-1-6-player-cooperative-boardgame,"I got my game yesterday and immediately played the beginner mission - I love it, it's a great game!

I noticed that one or two page indications in the manual are wrong. For example on one site it says go to page X for more information. But actually it's the page Y, just like stated in the subject index on the back of the manual. And there is another mistake in the text (can't remember that one at the moment). But that's okay, I figured it out.

Maybe I'll continue my translation work from the english manual into a german pdf, just to make it easier to read for german players. The version on your website is an old one.",1465551100,UHJvamVjdENvbW1lbnQtMTM1OTI2MjQ=
https://www.kickstarter.com/projects/1299225771/unknown-1-6-player-cooperative-boardgame,Thank you for the info Dave!,1464936297,UHJvamVjdENvbW1lbnQtMTM1Mjk4MzM=
https://www.kickstarter.com/projects/1299225771/unknown-1-6-player-cooperative-boardgame,Hey guys! Loving having the game to play. I'm actually taking the game to board game club tomorrow at school to try to teach it to teens.  By any chance can you upload a final version of the rules to either your site or bgg?,1464920955,UHJvamVjdENvbW1lbnQtMTM1Mjg2Mjc=
https://www.kickstarter.com/projects/1299225771/unknown-1-6-player-cooperative-boardgame,"Thomas: The games were delivered to the warehouse a few weeks ago, but the checking in process has been taking far longer than it should.  We are not very happy with them right now, but they assure us that it will be complete tomorrow and we can start shipping then.",1464801541,UHJvamVjdENvbW1lbnQtMTM1MTM5Mjc=
https://www.kickstarter.com/projects/1299225771/unknown-1-6-player-cooperative-boardgame,How far is the shipping process in Europe? Did anyone get it yet from the UK? :D,1464694741,UHJvamVjdENvbW1lbnQtMTM1MDEwMjc=
https://www.kickstarter.com/projects/1299225771/unknown-1-6-player-cooperative-boardgame,Got my copy!  Looks amazing and can't wait to try it out. :),1463891253,UHJvamVjdENvbW1lbnQtMTM0MjY5NjA=
https://www.kickstarter.com/projects/1299225771/unknown-1-6-player-cooperative-boardgame,"Carolyn: You can ask here, either through a message or comment, or send a Facebook message to the Rob and Dave Games page.  The last option *might* even buzz our phones and get you an immediate response, though that is as yet untested.",1463831272,UHJvamVjdENvbW1lbnQtMTM0MjI3OTg=
https://www.kickstarter.com/projects/1299225771/unknown-1-6-player-cooperative-boardgame,Got mine Wednesday and love it - I played a test game by myself and will play with friends tonight. Is there a good place to ask for rule clarifications?,1463766381,UHJvamVjdENvbW1lbnQtMTM0MTY5NjQ=
