project_url,comment,created_at,comment_id
https://www.kickstarter.com/projects/commuterx4/commuter-x4-the-wearable-fibre-optic-bike-light,"I recieved my package today! Still have to unbox it, but wanted to let you guys know one arrived on the other side of the North Sea just now. Olé!",1415130929,UHJvamVjdENvbW1lbnQtODI3Nzk3NA==
https://www.kickstarter.com/projects/commuterx4/commuter-x4-the-wearable-fibre-optic-bike-light,"Tested the X4 out tonight, worked first time after an initial four hour charge, getting some good comments, thanks for all the hard work and commitment, a great result",1415043529,UHJvamVjdENvbW1lbnQtODI2OTIwOQ==
https://www.kickstarter.com/projects/commuterx4/commuter-x4-the-wearable-fibre-optic-bike-light,"No worries. I've taken it into a dark room and tested, and I can see a very, very faint light (fainter than the charging light) in the middle. Just a case of a dud LED methinks. Will fire off an email in a bit re: exchange,",1415026817,UHJvamVjdENvbW1lbnQtODI2NzAzMQ==
https://www.kickstarter.com/projects/commuterx4/commuter-x4-the-wearable-fibre-optic-bike-light,"Hi Guys, sorry about the charging light. In short, it's a typo. The actual charging light is green, but through the lens it's obviously orange. There's clearly been some miscommunication here. 

Ultonian X, sorry about the central light. I've dropped you a message about it. But to re-iterate, try turning the unit off completely and hold the right hand button for 2 seconds to see if it turns on. If it doesn't, please drop us an email at info@veglo.cc to arrange a swap. Sorry for any inconvenience. Ed",1415025308,UHJvamVjdENvbW1lbnQtODI2NjkwMg==
https://www.kickstarter.com/projects/commuterx4/commuter-x4-the-wearable-fibre-optic-bike-light,AINapp - I get an orange light too. Seems to be a typo in the manual. No biggie.,1415024740,UHJvamVjdENvbW1lbnQtODI2NjgzOA==
https://www.kickstarter.com/projects/commuterx4/commuter-x4-the-wearable-fibre-optic-bike-light,"Got mine today. The left button seems to work for the lights in the straps (on, mode change, off), but I'm getting nada from the main light. Will leave it on charge for a bit more and retry later, but I think I'm going to have to see about a swap.",1415024505,UHJvamVjdENvbW1lbnQtODI2NjgyNA==
https://www.kickstarter.com/projects/commuterx4/commuter-x4-the-wearable-fibre-optic-bike-light,"It's here!
just plugged it in, hope it charges for ride home :)
(Hmm, not getting a green LED, getting an orange one - hope that is a typo in the manual, not a problem)",1415012036,UHJvamVjdENvbW1lbnQtODI2NjA0MA==
https://www.kickstarter.com/projects/commuterx4/commuter-x4-the-wearable-fibre-optic-bike-light,Got my email about shipping tracking etc... Very happy this is coming just in time for the failing light.... :),1413839440,UHJvamVjdENvbW1lbnQtODE2MTUyNw==
https://www.kickstarter.com/projects/commuterx4/commuter-x4-the-wearable-fibre-optic-bike-light,"Hi
Any update on the last update? Hoping to get my hands on this before the clocks change :)",1412070207,UHJvamVjdENvbW1lbnQtODAwMDUzNA==
https://www.kickstarter.com/projects/commuterx4/commuter-x4-the-wearable-fibre-optic-bike-light,Thanks Tom. We've actually flown a few units over for the show for trade and press. Visitors can also test these out and place a pre-order for when stock arrives later in October. Will you be at the show?,1411380933,UHJvamVjdENvbW1lbnQtNzkzNTQ3OA==
https://www.kickstarter.com/projects/commuterx4/commuter-x4-the-wearable-fibre-optic-bike-light,Hi there I am sure I saw something on Facebook about the x4 and the cycle show at the NEC ... Are they going to be on sale there?,1411327593,UHJvamVjdENvbW1lbnQtNzkzMTY3OQ==
https://www.kickstarter.com/projects/commuterx4/commuter-x4-the-wearable-fibre-optic-bike-light,"Hi Ferdinand, sorry to have missed this one!!! Yes, we'll most likely be using Royal Mail but this can vary depending on location. We'll do our best to use the most cost effective option for you, however we also want to use the most reliable option too. Thanks a lot.",1410277134,UHJvamVjdENvbW1lbnQtNzgyMTYxNg==
https://www.kickstarter.com/projects/commuterx4/commuter-x4-the-wearable-fibre-optic-bike-light,I hope the product will be sent by Royal Mail instead of FedEx or UPS - those two charge insane import fees..,1409603761,UHJvamVjdENvbW1lbnQtNzc1ODU0MA==
https://www.kickstarter.com/projects/commuterx4/commuter-x4-the-wearable-fibre-optic-bike-light,So.... how did the trip to China go? Just wondering how it's going. Would be nice to see an update after the trip.,1404725596,UHJvamVjdENvbW1lbnQtNzIxMTM5OQ==
https://www.kickstarter.com/projects/commuterx4/commuter-x4-the-wearable-fibre-optic-bike-light,How can I order/pledge for a quantity of 2,1399502314,UHJvamVjdENvbW1lbnQtNjcxNTgyMQ==
https://www.kickstarter.com/projects/commuterx4/commuter-x4-the-wearable-fibre-optic-bike-light,"Hi Felix, I completely hear you. Yes, the stretch goal will ensure we can produce more units to see us through the busiest buying season of the year which is the build up to, and during the Christmas period.",1398858973,UHJvamVjdENvbW1lbnQtNjY1Mzc4MQ==
https://www.kickstarter.com/projects/commuterx4/commuter-x4-the-wearable-fibre-optic-bike-light,"Well, i do know what the term stretch goal mean and how it is used here, but my question was what will there be after we went beyond 19k. Stretch goals aren't encouraging at all if they are just a number.",1398800837,UHJvamVjdENvbW1lbnQtNjY0ODI4Mg==
https://www.kickstarter.com/projects/commuterx4/commuter-x4-the-wearable-fibre-optic-bike-light,"Hi Felix. Our target was met with 12 days to go and Kickstarter suggests using stretch goals to encourage new backers for the remainder of the campaign. Stretch goals are commonly used. Thanks, Ed",1398757602,UHJvamVjdENvbW1lbnQtNjY0MzUzNQ==
https://www.kickstarter.com/projects/commuterx4/commuter-x4-the-wearable-fibre-optic-bike-light,"Did I miss something, what is the next stretch goal?",1398610301,UHJvamVjdENvbW1lbnQtNjYzMDYyOQ==
https://www.kickstarter.com/projects/2078963113/the-rocket-shoes-project,Love your song!,1397685692,UHJvamVjdENvbW1lbnQtNjUzNzMwNQ==
https://www.kickstarter.com/projects/171598125/the-sledge-patrol-a-feature-documentary,To ours backers this comment box is for for all there is interested in our project and you are velcome to to tell os all what you mean about it take the initiativ to tell all that wee have a need to tell this dokumentar to All Danish people..Thank you.,1398074157,UHJvamVjdENvbW1lbnQtNjU3NzE0Nw==
https://www.kickstarter.com/projects/171598125/the-sledge-patrol-a-feature-documentary,"To the bakers, thank you to visit the projekt and to bee abackers.The family the brother and the son  wery surpriset and thank Arktisk Museum and Natinalmuseet to hawe secured after  60 years Ejner Mikkelsens og Kurt Olsens diary from the Patrol. Thank you Thor og Børge",1398068960,UHJvamVjdENvbW1lbnQtNjU3NjkxOQ==
https://www.kickstarter.com/projects/171598125/the-sledge-patrol-a-feature-documentary,I thank Sandre to take this initiativ to make a dokumentar about this psatrol member and i too thank the backers tol tell our sposores this epoke  about 70 years will tell Danish people that Minister Kaufmand toke the initiativ because the danish government ncondemend.This from a danish soldiers educatet in Sverige 1944-45 1159 olsen,1398067971,UHJvamVjdENvbW1lbnQtNjU3Njg3Mg==
https://www.kickstarter.com/projects/gamesalute/seven-swords,Received my copy today and thankfully it is complete...for those missing dice it will be automatic that the stands are missing too because they are in the same plastic bag.... now to check out the game and see if I can devise an AI for the bandit side to make solitaire play a possibility....,1409845391,UHJvamVjdENvbW1lbnQtNzc4MzE5NQ==
https://www.kickstarter.com/projects/gamesalute/seven-swords,"Actually not only dice... References cards, cut outs stands... Wow",1401389787,UHJvamVjdENvbW1lbnQtNjg3NTAwNA==
https://www.kickstarter.com/projects/gamesalute/seven-swords,I have received the game today and dice are not included... I hope that you will fix this,1401385473,UHJvamVjdENvbW1lbnQtNjg3NDM5OA==
https://www.kickstarter.com/projects/gamesalute/seven-swords,"Greetings All,
    Thanks again for your support. As of today, we've posted the update that we've shipped all the packages early for folks who have completed the pledge manager. We'll be sending a separate envelope with the promo cards once those are printed up but since the games were available to ship before expected, we figured we'd give you an early month of play while awaiting the promo card. You can check out the full update here: https://www.kickstarter.com/projects/gamesalute/seven-swords/posts/849870

If you have any damages in shipment or missing pieces, we'll be happy to take care of that for you. Just visit www.GameSalute.com/Replacements and we'll get you all sorted. 

Thanks again for your support!

- Dan",1400599823,UHJvamVjdENvbW1lbnQtNjgwNjU0Ng==
https://www.kickstarter.com/projects/gamesalute/seven-swords,"I received my copy of Seven Swords today and because of the lack of packing to keep the game safe, the back of the box was pressed in making the box severely creased along the back. I am very disappointed by the lack of protection for the game. Getting a new game is very exciting except when that game arrives damaged.",1400540476,UHJvamVjdENvbW1lbnQtNjgwMjUwMg==
https://www.kickstarter.com/projects/gamesalute/seven-swords,"Well I really cannot comment too much about creating a bandit AI until I actually start playing the game. Sometimes an AI can be driven by charts, chits, die, event cards, or a combination of these. When I get the game in my hands and see how the bandit side plays, then I can determine what is the best method.",1398264214,UHJvamVjdENvbW1lbnQtNjU5ODMxOQ==
https://www.kickstarter.com/projects/gamesalute/seven-swords,"John, as a fellow solo player who loves the theme of this one, that's fantastic news!",1398243165,UHJvamVjdENvbW1lbnQtNjU5NjE3MQ==
https://www.kickstarter.com/projects/gamesalute/seven-swords,"Intriguing, John! Tell us a little about your idea, if you could?

Michael",1398192047,UHJvamVjdENvbW1lbnQtNjU5MDMxNA==
https://www.kickstarter.com/projects/gamesalute/seven-swords,I backed this game today because I am looking at the possibilities to create an AI for the bandit side so that a solo game can be played. I'll work on that once I get it.,1398100273,UHJvamVjdENvbW1lbnQtNjU3OTYxNg==
https://www.kickstarter.com/projects/gamesalute/seven-swords,"Kristian, you pretty much have this one right - for the Seven Swords campaign, the funding is to be used to import copies of the game. Yes, it also helps us gauge interest in the game, and from there we can decide on how many more copies to import (under our own steam, of course). 

With regards to the rulebook, I've read through it and yes, while there's a few grammatical errors, it's far from horrible. The rules work perfectly fine.

Also, thank you Larry! It is indeed a fun game. Hope you enjoy it.

Michael",1398078976,UHJvamVjdENvbW1lbnQtNjU3NzM3OA==
https://www.kickstarter.com/projects/gamesalute/seven-swords,It's $35.  It costs more to take the family out to McDs.  The game looks like fun.,1397991499,UHJvamVjdENvbW1lbnQtNjU3MTQzOA==
https://www.kickstarter.com/projects/gamesalute/seven-swords,"@Andrew, truly in a case like this the product is like a ""pre order,"" but I can understand why a publisher like Game Salute would be interested in a forum like kickstarter to reduce initial costs,  gauge/generate interest and rush some copies to supporters who will more likely review/promote the game positively. 

Of course I'd be interested in Game Salute's take on this question of yours too Andrew.",1397962207,UHJvamVjdENvbW1lbnQtNjU3MDIzNQ==
https://www.kickstarter.com/projects/gamesalute/seven-swords,"I should add that's not rhetorical. Why is this on Kickstarter? Also, how do you reconcile the horribly translated rulebook with your promise that the game ""will be produced with quality components?""",1397941919,UHJvamVjdENvbW1lbnQtNjU2ODg3NQ==
https://www.kickstarter.com/projects/gamesalute/seven-swords,So you're just importing a product? Why are you using Kickstarter then?,1397772735,UHJvamVjdENvbW1lbnQtNjU1MDAzOA==
https://www.kickstarter.com/projects/gamesalute/seven-swords,"@Andrew - I can assure you that the delivery date for Seven Swords will be met. We're bringing in copies of the game directly from Gen X to send out to you guys (and adding in the Koto promo card), so the turnaround for this project shouldn't be too long. It's when the games need to be produced that we often have to take a long time. When it's something like Seven Swords though, it's a much simpler process.

@Kristian - thank you as always. We're delighted that we've got you on board for this one :D Hope you enjoy the game when it lands!

Michael",1397733967,UHJvamVjdENvbW1lbnQtNjU0MzM5MA==
https://www.kickstarter.com/projects/gamesalute/seven-swords,"@Andrew, I pledged to 5 games of Game Salute last year, and I'll say that for a long while I was very vocally frustrated with the company, not just because of tardiness but mainly due to the lack of informative communication.  I spoke at length with both Michael and Game Salute' s owner/president Dan Yarrington and I'm happy to say that communication has improved tremendously across all of the projects of their's I've backed.  I'm much more confident now in coming back to support more of their projects. 

Also the games that I've supported of their's that have fulfilled, I've not only enjoyed the games but the components have been excellent as well. The games have been packed securely and shipped so that I've not received any with damage.",1397677928,UHJvamVjdENvbW1lbnQtNjUzNTI3Nw==
https://www.kickstarter.com/projects/gamesalute/seven-swords,"I'm tentatively in, based on the Designer Diary I read for this game. I see that the delivery date is June - is this game already printed and its just importing a copy? I've read lots of stuff about Game Salute games being delayed - should that be a worry here?",1397664021,UHJvamVjdENvbW1lbnQtNjUzMjA3Mg==
https://www.kickstarter.com/projects/gamesalute/seven-swords,"@Robert - thank you, sir! It's certainly getting closer and closer, I think we'll be grand!

@Byron - I shall check for you, but I believe that they're stickers. As for Mecanisburgo, we could certainly enquire on your behalf! 

Michael",1397558633,UHJvamVjdENvbW1lbnQtNjUxNTcwOA==
https://www.kickstarter.com/projects/gamesalute/seven-swords,"I'll make Kurosawa proud!  2 more backers guys, and we can save the village from despicable bandits! :D",1397540584,UHJvamVjdENvbW1lbnQtNjUxNDI1MQ==
https://www.kickstarter.com/projects/gamesalute/seven-swords,"Tentatively added my pledge, but I wanted to ask: are the numbers on the bottom of the wood pieces stickers, or are they printed on the wood itself?

Also, will you be bringing Mecanisburgo to the US as well? I saw it on the weekly briefing, but didn't see it on the site itself.",1397492953,UHJvamVjdENvbW1lbnQtNjUwNjk2Ng==
https://www.kickstarter.com/projects/gamesalute/seven-swords,"Well, we've got to hit the funding goal, Daryl! 

Kelly - banner ads on BGG are VERY expensive but we've got some on there, so hopefully they'll bring some people over. 

Michael",1397213427,UHJvamVjdENvbW1lbnQtNjQ4MDA3Mg==
https://www.kickstarter.com/projects/gamesalute/seven-swords,More Magnificent Seven!  http://www.youtube.com/watch?v=t0vqQjaXLOU,1397198748,UHJvamVjdENvbW1lbnQtNjQ3OTAyMw==
https://www.kickstarter.com/projects/gamesalute/seven-swords,"Game salute...dammit, this thing better actually SHIP!  *angry face*",1397194416,UHJvamVjdENvbW1lbnQtNjQ3ODcyMw==
https://www.kickstarter.com/projects/gamesalute/seven-swords,"With such a short campaign, we should pull out all the stops in hopes of success. A game play video and/or game review by well known reviewers + banner ads at sites such as BGG will be extremely instrumental in getting this thing done in less than 2 weeks from now.

Otherwise, this game has been ""sold short"". 

http://www.youtube.com/watch?v=8XDB7GMnbUQ",1397177806,UHJvamVjdENvbW1lbnQtNjQ3Njc3OQ==
https://www.kickstarter.com/projects/gamesalute/seven-swords,"I shall check, Jeff, but I believe these copies are coming from that printing, so it's unlikely. The Gen X Games team haven't posted an update yet, but the game rules are solid despite a couple of spelling mistakes!

Michael",1397132544,UHJvamVjdENvbW1lbnQtNjQ2ODYyMA==
https://www.kickstarter.com/projects/wishlessness/flatland-the-game-of-many-dimensions,"I'm sorry the campaign didn't reach the make the goal -- but it was so close! I think a re-launch would definitely succeed. Perhaps in a second campaign, you could offer the print 'n' play version of the game for folks to try. With a print 'n' play version, you could post the game to BoardGameGeek as well, bringing in another community of players.",1402361809,UHJvamVjdENvbW1lbnQtNjk2Nzc0Ng==
https://www.kickstarter.com/projects/wishlessness/flatland-the-game-of-many-dimensions,"@Casper Rognaldsen -- see update #8, with a link to the Carl Sagan show.",1402361576,UHJvamVjdENvbW1lbnQtNjk2NzcxNw==
https://www.kickstarter.com/projects/wishlessness/flatland-the-game-of-many-dimensions,"I came in really close to the end, so this might have been covered already, but Carl Sagan talked about flatland in a show. You'll find it on YouTube. I'm not sure about how copyright works since it's from an old show, but linking to YouTube should be no problem. You'll might be able to use the frames in some way as well:)",1402259392,UHJvamVjdENvbW1lbnQtNjk1ODc2NQ==
https://www.kickstarter.com/projects/wishlessness/flatland-the-game-of-many-dimensions,"Yes, I agree - please don't be discouraged, explore your options, and note that you came close to meeting your funding goal.  With perhaps more publicity and ways to reduce your goal (and still publish the game), I think that a re-launch could be successful.  When you do, be sure and contact your current backers via Kickstarter message and email, if possible, and hopefully they will promptly get on board and put your game that much closer to success!",1402220663,UHJvamVjdENvbW1lbnQtNjk1NjMwMQ==
https://www.kickstarter.com/projects/wishlessness/flatland-the-game-of-many-dimensions,"Adam - check out Custom Game Dice, a KS that just ended.  They can make specialty dice in many colors and for pretty cheap (for custom dice).  They have a company and site apart from the KS.  Maybe their pricing can help you relaunch with cheaper games and/or lesser goal required.",1402167743,UHJvamVjdENvbW1lbnQtNjk1MzI5NA==
https://www.kickstarter.com/projects/wishlessness/flatland-the-game-of-many-dimensions,"Regroup, relaunch, success!",1402162695,UHJvamVjdENvbW1lbnQtNjk1Mjg4OQ==
https://www.kickstarter.com/projects/wishlessness/flatland-the-game-of-many-dimensions,It's the final stretch!,1402016943,UHJvamVjdENvbW1lbnQtNjkzODYwNg==
https://www.kickstarter.com/projects/wishlessness/flatland-the-game-of-many-dimensions,"Good luck. Hoping to see this fund. Looks gorgeous. 

Space-time travel & geomtry, 
so yummy & geeky.

Vijaye Bhava!!!",1401673405,UHJvamVjdENvbW1lbnQtNjkwMjIyMw==
https://www.kickstarter.com/projects/wishlessness/flatland-the-game-of-many-dimensions,Time to get tweeting folks. Let's build momentum. I want to play this game. Try #geometry #flatland #dimension what are your favorite tags?,1401531577,UHJvamVjdENvbW1lbnQtNjg5MjA2Mw==
https://www.kickstarter.com/projects/wishlessness/flatland-the-game-of-many-dimensions,"Over 50% funded, with more than a week to go. Keeping my fingers crossed!",1401427010,UHJvamVjdENvbW1lbnQtNjg4MDA3Nw==
https://www.kickstarter.com/projects/wishlessness/flatland-the-game-of-many-dimensions,So very close to the 50% mark...,1401251835,UHJvamVjdENvbW1lbnQtNjg2MDk4Ng==
https://www.kickstarter.com/projects/wishlessness/flatland-the-game-of-many-dimensions,"You've got it. Triangles are divided into several groups. Isosceles triangles are soldiers and manual laborers while equilateral triangles are tradesmen. The genetics of Flatland are laid out in abundant detail in Part I, Section 3 of the book.",1401199434,UHJvamVjdENvbW1lbnQtNjg1NTMxOQ==
https://www.kickstarter.com/projects/wishlessness/flatland-the-game-of-many-dimensions,"Having just watched the animated film posted in #7, I realized I got the explanation of points wrong. Isosceles triangles are the military class. Time to go find my annotated Flatland on the bookshelf, I guess. :)",1401160148,UHJvamVjdENvbW1lbnQtNjg1MjY0Mg==
https://www.kickstarter.com/projects/wishlessness/flatland-the-game-of-many-dimensions,"Dean's suggestions are on point! A little exposition about the Flatland story and its characters will put the game in context. 
We have some time in this campaign for sure - though there is some work to be done...",1401070913,UHJvamVjdENvbW1lbnQtNjg0NjE4OA==
https://www.kickstarter.com/projects/wishlessness/flatland-the-game-of-many-dimensions,"But I do think it might help if the homepage explained the meanings behind the shape characters. For folks that haven't read the book, they might wonder why the point beats higher dimensional shapes. (Answer: Because points represent the Soldier caste in Abbott's Flatland.)",1401063812,UHJvamVjdENvbW1lbnQtNjg0NTgyOA==
https://www.kickstarter.com/projects/wishlessness/flatland-the-game-of-many-dimensions,There's still lots of time left in the campaign. Maybe a bit too early to think about a plan B.,1401063614,UHJvamVjdENvbW1lbnQtNjg0NTgyMA==
https://www.kickstarter.com/projects/wishlessness/flatland-the-game-of-many-dimensions,"Just curious, I've tried talking up to others but have had not much success. If we don't make the goal, will you make any and still sell to people that wanted it (say thru a website)? Or restart a second KS with a lower goal? Just wondering.",1400979108,UHJvamVjdENvbW1lbnQtNjg0MTkwMw==
https://www.kickstarter.com/projects/wishlessness/flatland-the-game-of-many-dimensions,This user's account has been deleted.,1400693301,UHJvamVjdENvbW1lbnQtNjgxNTgyMg==
https://www.kickstarter.com/projects/wishlessness/flatland-the-game-of-many-dimensions,"I'm a big fan of the Flatland book, so I'm excited about the game! The video updates (especially #6) have been really helpful explaining the concept.",1400642867,UHJvamVjdENvbW1lbnQtNjgxMTYzMQ==
https://www.kickstarter.com/projects/wishlessness/flatland-the-game-of-many-dimensions,"Hi Ammy. Thanks for your feedback.  You and John are absolutely right that Flatland's complexity (and strategy, and multi-player gameplay, and variety of pieces, etc.) are under-represented in the overview video. So for the bookish, I'm adding an expanded description of the rules (please sharpen your pencils). Pending is the magnum opus full play-through video with commentary that will hopefully show off Flatland in all its geeky glory!",1399119330,UHJvamVjdENvbW1lbnQtNjY3OTUwNg==
https://www.kickstarter.com/projects/wishlessness/flatland-the-game-of-many-dimensions,"After watching the video alone I thought the game was ridiculously simple, so much so i was frustratingly baffled - I couldn't understand why it was being proposed at all....

As John mentioned, I'd suggest making it a little more apparent that there's more to it! 
Anyway, this sounds like geeky fun and I'm looking forward to it!",1399117794,UHJvamVjdENvbW1lbnQtNjY3OTQ0MQ==
https://www.kickstarter.com/projects/wishlessness/flatland-the-game-of-many-dimensions,"Flatland requires a lot of set up to produce. In particular the custom-etched pieces are rather expensive in small volumes. In order to make Flatland an affordable product of top quality we have to produce a larger quantity of game sets. 

The goal number of 9990 is significant in that it represents 333 pledges at the WELCOME TO FLATLAND level. It's ambitious, though if we are going to make Flatland we want to make it the very best it can be.",1398348557,UHJvamVjdENvbW1lbnQtNjYwNzk1MQ==
https://www.kickstarter.com/projects/wishlessness/flatland-the-game-of-many-dimensions,I'm a little curious on why the goal is so high for this game.  Seems like a relatively simple production so I was wondering if 9990 was significant in any way.,1398344837,UHJvamVjdENvbW1lbnQtNjYwNzQ1Ng==
https://www.kickstarter.com/projects/wishlessness/flatland-the-game-of-many-dimensions,You might want to introduce some of the elements in your second update's video onto the main page. I thought that the game was way too simple until I learned how the dice worked and the rules regarding the void and tesseract.,1398236939,UHJvamVjdENvbW1lbnQtNjU5NTcyNg==
https://www.kickstarter.com/projects/wishlessness/flatland-the-game-of-many-dimensions,"It's great to see Flatland featured on Top Hat Sasquatch - Thanks a lot, Tommy!",1397664847,UHJvamVjdENvbW1lbnQtNjUzMjIyNw==
https://www.kickstarter.com/projects/thrivedesign/thrive-traveler-skate-luggage,Has anyone brought the Thrive bag on an Aer Lingus flight as carry on? Just wondering if they accepted it as carry on as the measurements of the bag are a wee bit bigger than what their website says they'll take.,1445012823,UHJvamVjdENvbW1lbnQtMTE0MTg1Nzk=
https://www.kickstarter.com/projects/thrivedesign/thrive-traveler-skate-luggage,"Thanks so much for the feedback!

Be sure to share your experiences on our website by sharing a product review!
http://www.thrivesnowboards.com/list/bags

Sincerely,

Doug Fagel",1435247871,UHJvamVjdENvbW1lbnQtMTAyOTg5MTY=
https://www.kickstarter.com/projects/thrivedesign/thrive-traveler-skate-luggage,Love my bag.  Love the long handle. Finally a bag tall people can roll easily through the airport.,1434926708,UHJvamVjdENvbW1lbnQtMTAyNTYyOTg=
