project_url,comment,created_at,comment_id
https://www.kickstarter.com/projects/1299225771/unknown-1-6-player-cooperative-boardgame,My copy arrived in the mail yesterday.  I enjoyed unboxing everything.  I'm impressed with the quality of the components.  I'm looking forward to playing this game soon.,1463736654,UHJvamVjdENvbW1lbnQtMTM0MTI5OTQ=
https://www.kickstarter.com/projects/1299225771/unknown-1-6-player-cooperative-boardgame,Just received mine in Houston Texas. Unboxing was an amazing experience.  The side of the inner box?  Oh no you didn't. What an amazing unexpected suprise. Thank you for making kickstarting Unknown such an amazing experience.  I will be playing this with the wife for the rest of the day and will keep my eyes open for the expansions.,1463689883,UHJvamVjdENvbW1lbnQtMTM0MDgyMTg=
https://www.kickstarter.com/projects/1299225771/unknown-1-6-player-cooperative-boardgame,Mine came today and i have to say everything is even better quality then expected!! Love the insert. can't wait to teach my game group.,1463680816,UHJvamVjdENvbW1lbnQtMTM0MDY2ODc=
https://www.kickstarter.com/projects/1299225771/unknown-1-6-player-cooperative-boardgame,"Got the game! We decided to try straight off the deep end by mixing all of the monsters in. This went rather well.. at least until encountering a party of Behemoths and Strangers. :p

Thank you!",1463559158,UHJvamVjdENvbW1lbnQtMTMzOTMwNDM=
https://www.kickstarter.com/projects/1299225771/unknown-1-6-player-cooperative-boardgame,Michael:  Thanks for the heads up!  You (and a few others) will be getting their second copy shipped out today.  Sorry for the delay.,1463520727,UHJvamVjdENvbW1lbnQtMTMzODk2NjM=
https://www.kickstarter.com/projects/1299225771/unknown-1-6-player-cooperative-boardgame,Just got my shipping tracking information.  I'm hoping I can get it before the end of the day on Thursday. :D Otherwise I'll have to wait until Sunday to check it out.,1463515842,UHJvamVjdENvbW1lbnQtMTMzODkwMDg=
https://www.kickstarter.com/projects/1299225771/unknown-1-6-player-cooperative-boardgame,"Hey guys,

I received a shipping confirmation yesterday, but it only shows a Quantity of 1. I backed at the rewards tier that included 2 copies of the board game. I just wanted to be sure that both copies are being shipped and that this didn't get lost in the shipping order at Amazon!

Thanks. :)",1463511639,UHJvamVjdENvbW1lbnQtMTMzODg0MDk=
https://www.kickstarter.com/projects/1299225771/unknown-1-6-player-cooperative-boardgame,Any new updates?,1460122878,UHJvamVjdENvbW1lbnQtMTI5NzM1OTM=
https://www.kickstarter.com/projects/827919495/adrians-model-airplane-kit-cutting-project,bad stuff always happens to good people - hope everything heals properly - take your time with the vacuum forming - you got my vote to launch another kickstarter followup kit offering to raise more $$$ to buy some humugus vacuum forming machine from China ? I would donate to you again - support your crafting the amazing kits from Canada - get well soon - the fly ;),1430619934,UHJvamVjdENvbW1lbnQtOTc4MzY4Nw==
https://www.kickstarter.com/projects/827919495/adrians-model-airplane-kit-cutting-project,If I was you I'd buy a few lottery tickets.....both at once shows some luck. ;-),1430426162,UHJvamVjdENvbW1lbnQtOTc2NTk4Nw==
https://www.kickstarter.com/projects/827919495/adrians-model-airplane-kit-cutting-project,"Just a note for all the backers.  I just got my 80"" cut kit and I must say a wonderful job.  Looks like this will come together fairly easily.  Looking to convert mine into an L4 or balsa FunCub.  Wonderful cut job...Tks Adrian.",1423870952,UHJvamVjdENvbW1lbnQtODk5NjYyMQ==
https://www.kickstarter.com/projects/827919495/adrians-model-airplane-kit-cutting-project,Wow!  I did not mean to get you to cut and pack this soon after knee surgery.  Just wanted to give you a chance to confirm orders and addresses while you were mending.  Tks for the update  ;-),1423187597,UHJvamVjdENvbW1lbnQtODkxMDczMA==
https://www.kickstarter.com/projects/827919495/adrians-model-airplane-kit-cutting-project,"Marc,

I'm packing 80"" Cub kits as we speak. Then the Z kits will be finished and packed. After that I will start on the 1/4 scale R2 kits. I can still only manage part work days unfortunately, due to my gammy knee. I'm seeing the surgeon tomorrow to see what he thinks is going on.

Adrian",1423053139,UHJvamVjdENvbW1lbnQtODg5MjI3Nw==
https://www.kickstarter.com/projects/827919495/adrians-model-airplane-kit-cutting-project,Hi Adrian - hope your recovery is going well.  Any chances you can contact those who have not yet received their kits via email to confirm shipping addresses. Tks,1423045996,UHJvamVjdENvbW1lbnQtODg5MTg2NA==
https://www.kickstarter.com/projects/827919495/adrians-model-airplane-kit-cutting-project,"Yes! There are parts and plans all over the place. I'm in full production mode. I got my vac forming machine cleaned up and working. It was a bit decrepit after sitting idle for over 10 years. I made a new mold for the R2 cowl over the weekend. It's huge! I don't remember it seeming so big. I am having to correct each cutting file as I go as they have ""anomalies"" from being translated from my Windows 95 software to my Windows 7 laser cutter software. Nothing major... just a lot of files. 

I am also slowly figuring out an efficient work flow. I tried making a jig for the laser table to cut 6 sheets at once but it was a pain. Now I'm cutting 1 sheet at a time and it seems a lot easier. I just can't do anything else while I'm cutting as I have change sheets every 3 minutes or so.

1700 square feet of plans showed up yesterday. This all a bit more overwhelming than I anticipated. I'm treating it as one would treat eating an elephant... one bite at a time. It won't be too much longer.

I'm not sure if I can post pictures to this comment page. I'll see if I can figure it out.

Adrian",1413997876,UHJvamVjdENvbW1lbnQtODE3NzY1MA==
https://www.kickstarter.com/projects/827919495/adrians-model-airplane-kit-cutting-project,"Was wondering about an update also, been well over a month since last one.",1413996683,UHJvamVjdENvbW1lbnQtODE3NzQ3OQ==
https://www.kickstarter.com/projects/827919495/adrians-model-airplane-kit-cutting-project,"Adrian, any updates?  Good time to look for a winter project. Thanks.  �",1413339704,UHJvamVjdENvbW1lbnQtODExODQ5OQ==
https://www.kickstarter.com/projects/827919495/adrians-model-airplane-kit-cutting-project,Congratulations! The radio control airplane kit world needs more kit manufacturers. Looking forward to seeing what airplanes you will be producing. A few rare and obscure airplanes would be nice.,1399611139,UHJvamVjdENvbW1lbnQtNjcyOTk1Mg==
https://www.kickstarter.com/projects/827919495/adrians-model-airplane-kit-cutting-project,"@Creator, Curious ... Which ""my own laser cutter"" are you going to buy? Congratulations on the success Adrian :)",1399342664,UHJvamVjdENvbW1lbnQtNjY5NzI0Nw==
https://www.kickstarter.com/projects/827919495/adrians-model-airplane-kit-cutting-project,Wooohoooo! Goal appears to have been supassed by a healthy margin.  Hopefully we'll see some warbird kits in the future  ;-),1398203150,UHJvamVjdENvbW1lbnQtNjU5MjA4OA==
https://www.kickstarter.com/projects/827919495/adrians-model-airplane-kit-cutting-project,I've just finished one of these. It would have to be the most enjoyable kit I've ever built and Adrian is a real 'stand up guy'.,1397546542,UHJvamVjdENvbW1lbnQtNjUxNDc2Nw==
https://www.kickstarter.com/projects/827919495/adrians-model-airplane-kit-cutting-project,Don't hesitate to back up Adrian! He's a stand up guy and a talented designer. You won't be disappointed!,1396973229,UHJvamVjdENvbW1lbnQtNjQ0MTIxOQ==
https://www.kickstarter.com/projects/1208144179/western-center-academys-raspberry-pi-makerspace,Congrats on the funding. Hope it keeps coming in :),1398040055,UHJvamVjdENvbW1lbnQtNjU3NTAxNg==
https://www.kickstarter.com/projects/1208144179/western-center-academys-raspberry-pi-makerspace,"Thanks, Todd. We appreciate it greatly. Your Raspians website is honorable. Krystal (raspberry pi kid) has been a little busy lately.  She is on her way to the state science fair soon and then will get back to blogging.  She appreciates that you follow her.  She has drafts of a couple of posts about 3D printing written that I've just been procrastinating on typing up for her. 

Thanks for your support,
Mike",1397095921,UHJvamVjdENvbW1lbnQtNjQ2NTEzMA==
https://www.kickstarter.com/projects/1208144179/western-center-academys-raspberry-pi-makerspace,"Hoping anyone in the community that can help put a @Raspberry_Pi into a students hand. Will help any way they can.. 
Best of Luck
Raspians. 

P.S. Thanks for the great articles Raspberry Pi Kid. I keep checking back for more. :)",1397019788,UHJvamVjdENvbW1lbnQtNjQ1MjgwNA==
https://www.kickstarter.com/projects/1003324989/fone-fang-ultimate-smartphone-stand-by-grip-your-k,Love the concept. How do I get more than 1?,1397803584,UHJvamVjdENvbW1lbnQtNjU1MzkwMQ==
https://www.kickstarter.com/projects/1003324989/fone-fang-ultimate-smartphone-stand-by-grip-your-k,Great idea! Thank you. Is it possible to pledge for more than one Fone Fang?,1397206102,UHJvamVjdENvbW1lbnQtNjQ3OTUzNg==
https://www.kickstarter.com/projects/magecompany/bgnews-season-1,Thanks George!,1399157759,UHJvamVjdENvbW1lbnQtNjY4MjI5Ng==
https://www.kickstarter.com/projects/magecompany/bgnews-season-1,My very best wishes for your project!,1399157688,UHJvamVjdENvbW1lbnQtNjY4MjI5Mg==
https://www.kickstarter.com/projects/magecompany/bgnews-season-1,Congratulation! I hope to see more successful projects!!!,1398898522,UHJvamVjdENvbW1lbnQtNjY1ODczNg==
https://www.kickstarter.com/projects/magecompany/bgnews-season-1,We did it!!!,1398877764,UHJvamVjdENvbW1lbnQtNjY1NTkyMA==
https://www.kickstarter.com/projects/magecompany/bgnews-season-1,Good job to everyone!!! Keep going!!!,1397195976,UHJvamVjdENvbW1lbnQtNjQ3ODgxMA==
https://www.kickstarter.com/projects/magecompany/bgnews-season-1,Thanks Babis! Thankfully we have a lot of time ahead and we hope people support our efforts! :),1397141017,UHJvamVjdENvbW1lbnQtNjQ2OTkxOA==
https://www.kickstarter.com/projects/magecompany/bgnews-season-1,Wishing all the best guys! Yourselves and your work deserve every penny! :D,1397140960,UHJvamVjdENvbW1lbnQtNjQ2OTkwMA==
https://www.kickstarter.com/projects/magecompany/bgnews-season-1,Thanks for the support Thanasis! :),1397125852,UHJvamVjdENvbW1lbnQtNjQ2ODAxMA==
https://www.kickstarter.com/projects/magecompany/bgnews-season-1,Good luck with your new website.,1397116001,UHJvamVjdENvbW1lbnQtNjQ2NzQwMQ==
https://www.kickstarter.com/projects/1504894374/country-music-tv-show-live-from-nieds-hotel,"Congratulations ""Slim"" aka Kevin, there was no doubt in my mind that you'd make it. I know you'll have great success. Looking forward to watching along to see how you're doing.
Again, CONGRADULATIONS!!!!!!!!!!!!!!",1401974067,UHJvamVjdENvbW1lbnQtNjkzMjQ2Ng==
https://www.kickstarter.com/projects/1504894374/country-music-tv-show-live-from-nieds-hotel,"Don't lose hope, Folks!  Stay tuned for a nice big jump in the total over the next 48 hours.  We're gonna make it and the main thing I want to stress at this point is that we still got reserved seats left in the Barroom and the Dining Room for July 19th when we make the Pilot Episode.  That would be the Buffalo and the Grizzly Bear premiums.  So spread the news to friends and kin!  After this all wraps up we will be in touch about gettin' your premiums to you.  Thanks a million to EVERYBODY who ""kicked in!""",1401722353,UHJvamVjdENvbW1lbnQtNjkwNTIxNw==
https://www.kickstarter.com/projects/1504894374/country-music-tv-show-live-from-nieds-hotel,:),1400987226,UHJvamVjdENvbW1lbnQtNjg0MjI5Mg==
https://www.kickstarter.com/projects/1504894374/country-music-tv-show-live-from-nieds-hotel,Huh--seems like the pledges have stalled out!!!,1399934487,UHJvamVjdENvbW1lbnQtNjc1NTA0OQ==
https://www.kickstarter.com/projects/1504894374/country-music-tv-show-live-from-nieds-hotel,"Come on people, get them wallets out. Time's a runnin short. A little bit here, a little bit there, it all adds up.",1399675436,UHJvamVjdENvbW1lbnQtNjczNjkzNQ==
https://www.kickstarter.com/projects/1504894374/country-music-tv-show-live-from-nieds-hotel,"There's only 32 days left. So, come on Pittsburghians & Bradfordians, help support a local talented man on his endeavor to reach his goal. Instead of buying a pizza tonite, put that money towards a pledge. Thank you & have a good day.",1399299348,UHJvamVjdENvbW1lbnQtNjY5MTU5NA==
https://www.kickstarter.com/projects/939547683/super-console-kid,This is going to be a great game. I love the design and the controls seem beautifully simple. Can't wait to play it on my Android phone. You've got $25 from me. I wish I could have pledged a lot more as I would have loved to base a costume and a level on the BBC Micro classic 'Stryker's Run'.,1397210476,UHJvamVjdENvbW1lbnQtNjQ3OTgyMA==
https://www.kickstarter.com/projects/939547683/super-console-kid,"I love it, 

I hope you get a chance to check out my Kickstarter, maybe you will like it to. Its called Console Warz. What are the chances of us both launching a Kickstarter around the same time with console in the title :) 

I really hope you are successful with your campaign man. Super console Kid needs a 1up",1397152321,UHJvamVjdENvbW1lbnQtNjQ3MjQzOQ==
https://www.kickstarter.com/projects/939547683/super-console-kid,Pretty cool game. I hope you get the support.,1397010880,UHJvamVjdENvbW1lbnQtNjQ1MTgwMg==
https://www.kickstarter.com/projects/571039503/new-nowhere-a-literary-journal,"@Pamela Macfie:

Hey Pamela, 
Thanks so much for your support! We do have a contingency plan, but we're confident that we'll be able to close that gap with new pledges before it's all over. 
The most helpful thing at this point is to keep spreading the word and sharing the project with folks via social media, email etc. 

Thanks for your support! 
Patrick & Mark",1399668896,UHJvamVjdENvbW1lbnQtNjczNjA4OA==
https://www.kickstarter.com/projects/571039503/new-nowhere-a-literary-journal,"getting so close!  if folks slow down, what about asking everyone who has pledged to kick in an extra 20 dollars, and then we'd be there!  tell me there's a contingency plan1",1399666104,UHJvamVjdENvbW1lbnQtNjczNTY3NQ==
https://www.kickstarter.com/projects/1919152504/where-the-wild-things-are,"Yes Robert, agreed, IP laws allow use of images if even minor minor modifications are made.. your work should be allowed.. but still, you are making a map for others and this is important..  i hope your work makes bold strong innovative maps .. and tshirts?   : )",1397036222,UHJvamVjdENvbW1lbnQtNjQ1NDAyOQ==
https://www.kickstarter.com/projects/1919152504/where-the-wild-things-are,"Hey, thanks... help spread the word if you can!  :)
As far as I know, it definitely is fine as far as the copyright goes.  It is being transferred to a completely different medium, style, and has a large majority of the image (most notably the background) completely removed.",1397012203,UHJvamVjdENvbW1lbnQtNjQ1MTk1Mg==
https://www.kickstarter.com/projects/1919152504/where-the-wild-things-are,"First, the Wild Things art has always been captivating and inspiring... great focus.. second, how does the IP rights work on this?  Derivative works are almost always allowed, yes?  but i'm sure you've thought that out prior to.. even minor changes make it ok, and you're re-making the images...  so it's totally legit i think... Third.. I love 60 day projects, which are not good for all purposes, but for art, it allows you to work a lot during the project.. more creative outcome... so.. really good work!  and this is only your Thirteenth Project!  so we have room to grow!   the record is about 50 projects by one creator!  you're in the race!  blessings",1396986067,UHJvamVjdENvbW1lbnQtNjQ0NDYzMg==
https://www.kickstarter.com/projects/joseriverajr/of-cake-and-vanity-a-musical-painting-by-jose-rive,Congratulations Joey! Break a leg! Love u lots!,1396984624,UHJvamVjdENvbW1lbnQtNjQ0NDI3MQ==
https://www.kickstarter.com/projects/joseriverajr/of-cake-and-vanity-a-musical-painting-by-jose-rive,Congratulations Joey!!! Cindy and I are so proud and so happy to back your project!,1396984078,UHJvamVjdENvbW1lbnQtNjQ0NDE0Ng==
https://www.kickstarter.com/projects/padbury/atelier-playing-cards,"Hi Robert,

I haven't logged in kickstarter for many months, completely forgot i had funded a couple of projects!

Have now responded with delivery address. Will I still be able to get the playing cards?

Thanks.

David",1415477775,UHJvamVjdENvbW1lbnQtODMxMTgyNw==
https://www.kickstarter.com/projects/padbury/atelier-playing-cards,"Hi! I've still haven't received my two card decks, could you please contact me? Cheers from Barcelona.",1413357190,UHJvamVjdENvbW1lbnQtODExOTYzNw==
https://www.kickstarter.com/projects/padbury/atelier-playing-cards,Thank you for the beautiful cards!,1411672678,UHJvamVjdENvbW1lbnQtNzk2Njg1MA==
https://www.kickstarter.com/projects/padbury/atelier-playing-cards,"Got my cards and I absolutely love them!
Thank you for the good work.",1410823361,UHJvamVjdENvbW1lbnQtNzg3NjgzOA==
https://www.kickstarter.com/projects/padbury/atelier-playing-cards,Atelier has landed in Manila. Excellent work you guys!,1410701469,UHJvamVjdENvbW1lbnQtNzg2Mzc5OA==
https://www.kickstarter.com/projects/padbury/atelier-playing-cards,Yay! These cards are amazing :),1410007864,UHJvamVjdENvbW1lbnQtNzgwMDA5Mw==
https://www.kickstarter.com/projects/padbury/atelier-playing-cards,"Got my cards and shirt over the weekend.
The cards are awesome. They look and feel fantastic. and the shirt is great too.

Thank you!",1409518822,UHJvamVjdENvbW1lbnQtNzc0OTUzNw==
https://www.kickstarter.com/projects/padbury/atelier-playing-cards,I just received the cards and i am so happy with it!! It feels like you hold something very precious thing of art in your hand :) thank you very much,1409408379,UHJvamVjdENvbW1lbnQtNzczNjIxNA==
https://www.kickstarter.com/projects/padbury/atelier-playing-cards,And might I add as well: The expected shipping was spot on.,1409196245,UHJvamVjdENvbW1lbnQtNzcwODUxMg==
https://www.kickstarter.com/projects/padbury/atelier-playing-cards,Just came home to expect a amazon package and instead found 2! The shirt is amazing and has some great quality. More pics to come. http://snoddad.com/kickstarter/Atelier-Cards1.jpg,1409194232,UHJvamVjdENvbW1lbnQtNzcwODM0Ng==
https://www.kickstarter.com/projects/padbury/atelier-playing-cards,"Redefined mine today in Pennsylvania. Lovely feel and look to the cards! Love the t-shirt as well. 

Beautiful work! Congratulations!",1409176808,UHJvamVjdENvbW1lbnQtNzcwNjM2OA==
https://www.kickstarter.com/projects/padbury/atelier-playing-cards,"Received mine today (UK!), they look awesome, thanks so much :)",1409151020,UHJvamVjdENvbW1lbnQtNzcwMjEyMA==
https://www.kickstarter.com/projects/padbury/atelier-playing-cards,Your fulfilment is waaaay ahead of your expectations - I have mine already and I'm in the UK! And they're very nice. Thanks for a great product. Here's hoping you do more.,1409062709,UHJvamVjdENvbW1lbnQtNzY5MTc3Nw==
https://www.kickstarter.com/projects/padbury/atelier-playing-cards,"got em, gorgeou scards",1409048279,UHJvamVjdENvbW1lbnQtNzY5MDQ0Nw==
https://www.kickstarter.com/projects/padbury/atelier-playing-cards,Got my decks - Love them!,1408990115,UHJvamVjdENvbW1lbnQtNzY4NDQ2Mg==
https://www.kickstarter.com/projects/padbury/atelier-playing-cards,"got mine today, amazing feel",1408982756,UHJvamVjdENvbW1lbnQtNzY4MzQxMQ==
https://www.kickstarter.com/projects/padbury/atelier-playing-cards,"Haven't gotten my cards yet! Hoping to get them by Monday!
I live in LA so I should have gotten them by now..",1408869572,UHJvamVjdENvbW1lbnQtNzY3Mzg2NA==
https://www.kickstarter.com/projects/padbury/atelier-playing-cards,Got my decks. AMAZING!! Thank you! :),1408845522,UHJvamVjdENvbW1lbnQtNzY3MjYwNw==
https://www.kickstarter.com/projects/padbury/atelier-playing-cards,"Received my two decks today, too. beautiful cards.",1408802820,UHJvamVjdENvbW1lbnQtNzY2ODI4Mg==
https://www.kickstarter.com/projects/padbury/atelier-playing-cards,"Got my decks today. Thank you, Robert! The quality is incredibly nice but a little slippery, so be mindful when the cards are stacked on top of each other (this could be just me though).",1408760440,UHJvamVjdENvbW1lbnQtNzY2NTk0NA==
https://www.kickstarter.com/projects/padbury/atelier-playing-cards,Received my two decks today.  They look very nice.  Thanks!,1408742187,UHJvamVjdENvbW1lbnQtNzY2MzkyMw==
https://www.kickstarter.com/projects/padbury/atelier-playing-cards,"Huzzah!
How exciting and congratulations!",1408052660,UHJvamVjdENvbW1lbnQtNzU5ODQ5Mg==
https://www.kickstarter.com/projects/padbury/atelier-playing-cards,"Hi Robert,
I hope to know how long will it take until I receive your amazing cards in Germany! I have a vacation plan from 12. August to end September. so if I cant receive my package in next 3 weeks, before I leave, delivery service will keep that package about 1 week and send back to shipper. Is there any chance that the delivery can make in time? Or is there any other solution.
Regards",1406329849,UHJvamVjdENvbW1lbnQtNzQyNDUzMw==
https://www.kickstarter.com/projects/padbury/atelier-playing-cards,Going to be an update soon. The cards should be arriving any day now.,1406148953,UHJvamVjdENvbW1lbnQtNzM5NzQ4Nw==
https://www.kickstarter.com/projects/padbury/atelier-playing-cards,Any news?,1406143967,UHJvamVjdENvbW1lbnQtNzM5NjQzNg==
https://www.kickstarter.com/projects/1233337111/keptpets-usa-jerky-treats,I never received my product.,1421779502,UHJvamVjdENvbW1lbnQtODc3MjU0OA==
https://www.kickstarter.com/projects/1233337111/keptpets-usa-jerky-treats,Dan posted today on his Facebook that they are shipping today.   Yea!!!!,1410394280,UHJvamVjdENvbW1lbnQtNzgzNTM1Nw==
https://www.kickstarter.com/projects/1233337111/keptpets-usa-jerky-treats,Has anyone gotten this/heard from them?,1409518097,UHJvamVjdENvbW1lbnQtNzc0OTI5Nw==
https://www.kickstarter.com/projects/1233337111/keptpets-usa-jerky-treats,Wow!!!  You did it.  So happy for you. Best of luck.,1399582821,UHJvamVjdENvbW1lbnQtNjcyNjYzOA==
https://www.kickstarter.com/projects/1233337111/keptpets-usa-jerky-treats,Good luck guys! You deserve this. :),1399576111,UHJvamVjdENvbW1lbnQtNjcyNTQ4Mg==
https://www.kickstarter.com/projects/1819640009/gamechanger,"Thank you again for backing us so generously!
We provide visuals of the three models on our website :
Flipoc.com
The final semi-transparent injection molded PC parts with rubber coating will be absolutely high-end.
I hope this answers your question.
Best,
Ernst",1399215588,UHJvamVjdENvbW1lbnQtNjY4NTUzMg==
https://www.kickstarter.com/projects/1819640009/gamechanger,Hahah Dale!! Flipoc.com buddy,1399215240,UHJvamVjdENvbW1lbnQtNjY4NTUxMw==
https://www.kickstarter.com/projects/1819640009/gamechanger,"Gentlemen, anywhere I can see photos of all three models?",1399214957,UHJvamVjdENvbW1lbnQtNjY4NTQ5Ng==
https://www.kickstarter.com/projects/698299576/our-stories-of-survival,You're getting close to your goal!  Good luck and best wishes!  Bill,1397712083,UHJvamVjdENvbW1lbnQtNjU0MTc2MQ==
https://www.kickstarter.com/projects/commuterx4/commuter-x4-the-wearable-fibre-optic-bike-light,"Hi Alex, 

That's great news! This keeps happening and increasingly so. 

If people ask where they can get one, just send them to www.veglo.cc, our website. Free world wide shipping! 

Thanks for spreading the word! 

Ed",1447141862,UHJvamVjdENvbW1lbnQtMTE2ODMyMDQ=
https://www.kickstarter.com/projects/commuterx4/commuter-x4-the-wearable-fibre-optic-bike-light,"Just thought you would like to hear, I was stopped twice this week with people wanting to know where to get one. What should I tell them?",1447119975,UHJvamVjdENvbW1lbnQtMTE2ODEzMDQ=
https://www.kickstarter.com/projects/commuterx4/commuter-x4-the-wearable-fibre-optic-bike-light,"I've worn it a few times when running outside late in the evening. It works really well; lot's of cars don't just spot me early and they give me 'right-of-way' a lot more WITH the Veglo than without one. It's a funny, positive side-effect. One thing that is a bit annoying for running, is that the straps over my shoulders start to come loose. The straps appear too smooth and don't generate enough friction against their plastic strap-on-thingy to stay in place. 
All in all... nice product!",1421675357,UHJvamVjdENvbW1lbnQtODc2MjY0Nw==
https://www.kickstarter.com/projects/commuterx4/commuter-x4-the-wearable-fibre-optic-bike-light,"Been using my replacement all month, works well, all is fine. Only minor (and it's very minor) niggle I have with it is that the process of turning it off and on again changes the state of the light i.e. constant -> flashing and I have to click it back to constant. Would prefer it if it remained on the constant setting during the off -> on cycle in the same way my Cateye lights do.",1416485588,UHJvamVjdENvbW1lbnQtODQwMTk1NA==
https://www.kickstarter.com/projects/commuterx4/commuter-x4-the-wearable-fibre-optic-bike-light,"Have charged today and wow, it works really well and I'm really pleased with the combinations you can have. Just need to hitch over the bag and off we go tomorrow. This will be a hit - a great invention. Well done, guys.",1415557290,UHJvamVjdENvbW1lbnQtODMxNjAzMQ==
https://www.kickstarter.com/projects/commuterx4/commuter-x4-the-wearable-fibre-optic-bike-light,Mine arrived a few days ago (UK) and I finally picked it up from the post office today and tried it out tonight on my rucksack. It works well :-). I look forward to trying it without a bag soon too. Great job veglo!,1415489863,UHJvamVjdENvbW1lbnQtODMxMjc2Nw==
