project_url,comment,created_at,comment_id
https://www.kickstarter.com/projects/2005101905/my-nana-is-a-super-spy-childrens-book-about-aging,"I am sorry for your personal problems however it is your responsible to keep your backers informed. an email once in a while would work.
I would like to have your address, phone number and email address.
by your actions and keeping your backers in the dark for a year and half I had no other choice but to feel that us backers had been scammed. I personally feel its been long enough already.
so if this going to take another year? keep your backers in the loop. Taking our money and never hearing from you is a very asshole thing to do. welcome to the grown world.",1451947668,UHJvamVjdENvbW1lbnQtMTIxNzA1MDE=
https://www.kickstarter.com/projects/2005101905/my-nana-is-a-super-spy-childrens-book-about-aging,"Ron, as I told you before, this book publishing is proving harder than I previously expected.  This past year and a half has been very hard on me.  I relocated to take care of my grandfather who was battling cancer and passed away.  I have been very depressed and struggling for awhile now.  I cared for my Nana for the last three years of her life and loved her very much.  I'm embarrassed and sad that the book is not published yet.  This is my first book and I'm unsure of the whole process.  How many books have you published?  I never intended to ""scam"" people out of money.  You calling me a ""crook"" is a very asshole thing to do.  I'm sorry you feel that way.",1451760497,UHJvamVjdENvbW1lbnQtMTIxNjA2NjM=
https://www.kickstarter.com/projects/2005101905/my-nana-is-a-super-spy-childrens-book-about-aging,"Ron, I really don't appreciate you calling me a sham and a crook.  This past year has been really hard on me.  I relocated to care for my grandfather who battled cancer and died.  I have been struggling with that and several other issues.  I explained all of this before.  I'm getting the book published soon.  It has proven more difficult than previously expected.  My intentions were never to ""scam"" people.  I cared for my Nana for the last 3 years of her life and loved her very much.  I feel embarrassed and sad that the book is not done yet.  You calling me  ""crook"" and threatening to track me down is an asshole thing to do.   I asked you for patience in my last email to you.  This is my first book so I don't know the exact process.",1451759861,UHJvamVjdENvbW1lbnQtMTIxNjA2MzI=
https://www.kickstarter.com/projects/2005101905/my-nana-is-a-super-spy-childrens-book-about-aging,"If anyone can help me find Dorian please contact me at.
Rowemont@gmail.com",1451712581,UHJvamVjdENvbW1lbnQtMTIxNTkwNjA=
https://www.kickstarter.com/projects/2005101905/my-nana-is-a-super-spy-childrens-book-about-aging,"Dorian, I am going to track you down and expose you as the crook you are.
This book was just a sham. It was just a way for you to screw your family and friends out of over
$10,000. I will sue you when I find you.",1451712381,UHJvamVjdENvbW1lbnQtMTIxNTkwNDc=
https://www.kickstarter.com/projects/2005101905/my-nana-is-a-super-spy-childrens-book-about-aging,"I agree with Mark, anything would be better than silence...",1447714669,UHJvamVjdENvbW1lbnQtMTE3NTQ3NzE=
https://www.kickstarter.com/projects/2005101905/my-nana-is-a-super-spy-childrens-book-about-aging,"Dorian, I was just thinking about this campaign the other day. While, I only gave a small amount because it seemed like a good cause, it's clear from the comments that others with more substantial donations have not received anything yet either. You haven't provided any updates on the page since the project was funded and it's been over a year since the projected delivery date. While the reality is that many projects on Kickstarter don't make it, you owe your backers the truth, especially because you relied on your relationship with your Nana, one which many people in sure we're truly touched by, to drive donations.",1445112525,UHJvamVjdENvbW1lbnQtMTE0Mjk5MTM=
https://www.kickstarter.com/projects/2005101905/my-nana-is-a-super-spy-childrens-book-about-aging,I haven't seen this book yet. A little concerned because I was looking forward to reading it to my 3 year old and now he is 5 years old.,1442253304,UHJvamVjdENvbW1lbnQtMTEwODAxMjM=
https://www.kickstarter.com/projects/2005101905/my-nana-is-a-super-spy-childrens-book-about-aging,dorian please call me and lets get this matter settled.,1437254094,UHJvamVjdENvbW1lbnQtMTA2MDI5MzI=
https://www.kickstarter.com/projects/2005101905/my-nana-is-a-super-spy-childrens-book-about-aging,"today is July 18,2015 
I think this book and dorian macneil was a big scam. not a word from him or any book. matter of fact I am thinking about suing him to get my money back.",1437253825,UHJvamVjdENvbW1lbnQtMTA2MDI4NzU=
https://www.kickstarter.com/projects/2005101905/my-nana-is-a-super-spy-childrens-book-about-aging,How is the book coming along?,1412660943,UHJvamVjdENvbW1lbnQtODA1NzAwOA==
https://www.kickstarter.com/projects/2005101905/my-nana-is-a-super-spy-childrens-book-about-aging,Congratulations!,1399513731,UHJvamVjdENvbW1lbnQtNjcxNzUwNA==
https://www.kickstarter.com/projects/1364679504/seas-of-iron-rising-sun-0,Still no product. This really is turning out to be a bad call on my part. I shouldn't have backed this. Think it's time to contact Kickstarter.,1444040760,UHJvamVjdENvbW1lbnQtMTEyOTI4Mjc=
https://www.kickstarter.com/projects/1364679504/seas-of-iron-rising-sun-0,Still not received my copy. Would love to know if mine ever shipped.,1437414778,UHJvamVjdENvbW1lbnQtMTA2MjMxNjA=
https://www.kickstarter.com/projects/1364679504/seas-of-iron-rising-sun-0,This user's account has been deleted.,1433082317,UHJvamVjdENvbW1lbnQtMTAwMTExMTQ=
https://www.kickstarter.com/projects/1364679504/seas-of-iron-rising-sun-0,"The last of the copies are going out this week. Being a one-man-band with a full time job, its a bit of a challenge to get everything done at once.

There are only 88 tokens in the set. Due to layout changes we dropped a sheet of tokens that brought them to 88 instead of 96. So do not fear you are not missing anything. It appears their is a misprint on some of the double sided plane tokens (red/green). Luckily an extra plane token is included for each color and gameplay is not affected, you may just have to exchange tokens in/out instead of flipping them.",1432694125,UHJvamVjdENvbW1lbnQtOTk3NDYzOQ==
https://www.kickstarter.com/projects/1364679504/seas-of-iron-rising-sun-0,"@Christopher W Ganshaw  Thank you for the F=Front; B=Back observation.  I opened this at work and didn't have a lot of time.  Still, both of my expansions only had sheets #1 to #11 with (8) tokens to a sheet, that comes to (88) total instead of (96).  Could be that there is a missing sheet #12, or the number of needed tokens was reduced.",1432684321,UHJvamVjdENvbW1lbnQtOTk3Mzc0Ng==
https://www.kickstarter.com/projects/1364679504/seas-of-iron-rising-sun-0,"After looking a little closer, the back of the Plane tokens reflect the plane having taken damage.  How to read through the rules and play a game or two and combine with SoI.",1432683214,UHJvamVjdENvbW1lbnQtOTk3MzYwOA==
https://www.kickstarter.com/projects/1364679504/seas-of-iron-rising-sun-0,"Arrived today in NYC.  Appears to have shipped on the 16th.  As for the cards, F/B...  F = front, B = back.",1432683033,UHJvamVjdENvbW1lbnQtOTk3MzU4NQ==
https://www.kickstarter.com/projects/1364679504/seas-of-iron-rising-sun-0,"I just checked mine. I got 11F but no 11B. Thanks, Karl, for your post; what tokens come on sheet 11B?",1432673609,UHJvamVjdENvbW1lbnQtOTk3MjM4OA==
https://www.kickstarter.com/projects/1364679504/seas-of-iron-rising-sun-0,"I just received my reward of two expansions here in San Diego, California, but I believe I am missing a sheet of 8-tokens in each box.  

The back of the box lists what should be inside, unfortunetly each box had (11) cardboard sheets of 8-pouch tokens for (88) total tokens instead of the 96 listed on the box and on KS project page.  In both boxes I received boards #1 to #8, plus board #9B and #10F.  One box had board #11F and in the other had board #11B.  My guess is that each box should have both #11B & #11F.

The other listed items are present:  (1) Rule Booklet; (4) six-sided approx. 7/16"" dice; (25) Card Events, and (5) Aircraft Carriers in five-card sets double sided (Set #9=Akagi; Set #10= USS Enterprise; Set #11=USS Yorktown; Set #12=USS Hornet; Set #13=Shinano).",1432672692,UHJvamVjdENvbW1lbnQtOTk3MjI5NQ==
https://www.kickstarter.com/projects/1364679504/seas-of-iron-rising-sun-0,I was just wondering if anyone has received their copy yet? Or any tracking info?,1432398374,UHJvamVjdENvbW1lbnQtOTk1MTcxNg==
https://www.kickstarter.com/projects/1364679504/seas-of-iron-rising-sun-0,"By this point you would expect that all copies have shipped.  Was hoping to have it this weekend.  I am assuming it was shipped USPS, is that correct?",1432385446,UHJvamVjdENvbW1lbnQtOTk1MDc1Mw==
https://www.kickstarter.com/projects/1364679504/seas-of-iron-rising-sun-0,"So april is almost over, have they been shipped yet or what is the status. thanks in advance.",1430171975,UHJvamVjdENvbW1lbnQtOTc0MTAwNw==
https://www.kickstarter.com/projects/1364679504/seas-of-iron-rising-sun-0,"@Daniel, My bad, found the mail and downloaded the file. Sorry about that and thank you.",1429524121,UHJvamVjdENvbW1lbnQtOTY4MjU2Mg==
https://www.kickstarter.com/projects/1364679504/seas-of-iron-rising-sun-0,@ Gianluca Casu: I actually released the print n play back in December and posted an update about it. You should have received a code for download.,1427964123,UHJvamVjdENvbW1lbnQtOTUzNDM3MA==
https://www.kickstarter.com/projects/1364679504/seas-of-iron-rising-sun-0,"Daniel, any news about the PnP?",1427963318,UHJvamVjdENvbW1lbnQtOTUzNDMwNw==
https://www.kickstarter.com/projects/1364679504/seas-of-iron-rising-sun-0,"I'm honestly a bit annoyed. This project had to be delivered in september 2014 and we get a message almost April 2015 ""It will ship soon""

I'm in for the PnP and did not appreciate the fact that Daniel found unfair that I get what I paid for. I would have got it before the time, nut seriusly, what would have been the problem?",1427116314,UHJvamVjdENvbW1lbnQtOTQwMTI4NQ==
https://www.kickstarter.com/projects/1364679504/seas-of-iron-rising-sun-0,"Awesome, thank you for the update.",1426874938,UHJvamVjdENvbW1lbnQtOTM3NTU4OA==
https://www.kickstarter.com/projects/1364679504/seas-of-iron-rising-sun-0,"This is making me nervous. I just had one game company declare bankruptcy and I'm probably out that money. I like the game but when there is no response for 3 months, I'm thinking something bad has happened.",1426800800,UHJvamVjdENvbW1lbnQtOTM2NTI0MQ==
https://www.kickstarter.com/projects/1364679504/seas-of-iron-rising-sun-0,Yeah it would be nice to hear something from them. I'm not sure what is going on either but I just checked their website and it is still with christmas sales. I don't know if that should worry me or if they just haven't updated their website.,1426641312,UHJvamVjdENvbW1lbnQtOTM0MjY2NA==
https://www.kickstarter.com/projects/1364679504/seas-of-iron-rising-sun-0,"It would be nice to hear something ""official"".  Having back the previous KS as well, I was hoping to see more from the game system.  But, with the poor response on this KS, I cannot imagine there will be anything further....  shame.",1426441325,UHJvamVjdENvbW1lbnQtOTMxNDYyMg==
https://www.kickstarter.com/projects/1364679504/seas-of-iron-rising-sun-0,"awesome, well I'm glad someone kinda heard something haha. I hope they update soon. I'm getting worried that something major happened.",1425953719,UHJvamVjdENvbW1lbnQtOTI0NzUzNQ==
https://www.kickstarter.com/projects/1364679504/seas-of-iron-rising-sun-0,"I work in a game shop. Today I saw a solicitation for this game, with a June release date. Three months! So we should get our copies before then?",1425537896,UHJvamVjdENvbW1lbnQtOTE5NjEyMQ==
https://www.kickstarter.com/projects/1364679504/seas-of-iron-rising-sun-0,Bueller?,1425329284,UHJvamVjdENvbW1lbnQtOTE2NjU5Nw==
https://www.kickstarter.com/projects/1364679504/seas-of-iron-rising-sun-0,Any updates? This game is now running late and no updates in a while.,1424219034,UHJvamVjdENvbW1lbnQtOTAzODE4MQ==
https://www.kickstarter.com/projects/1364679504/seas-of-iron-rising-sun-0,"Dear Sir or Ma'am,

Please let us know how the project is progressing.  Understand if  you are behind, but any information would be appreciated.",1424131258,UHJvamVjdENvbW1lbnQtOTAyMDUyNw==
https://www.kickstarter.com/projects/pamshaffermusic/metalalia-multimedia-fairytales-for-your-tablet-an,"Olivia and Mark...you will be excited to know that Metalalia goes live on iOS on Friday, Dec 12! We are working on developing the web version next so our app can be viewed on Droid as well as on computers. It's been a crazy year!",1418289032,UHJvamVjdENvbW1lbnQtODU0ODkyNQ==
https://www.kickstarter.com/projects/pamshaffermusic/metalalia-multimedia-fairytales-for-your-tablet-an,What Olivia said?,1412964751,UHJvamVjdENvbW1lbnQtODA4NzYxMQ==
https://www.kickstarter.com/projects/pamshaffermusic/metalalia-multimedia-fairytales-for-your-tablet-an,Any news?,1412730966,UHJvamVjdENvbW1lbnQtODA2NDg2MA==
https://www.kickstarter.com/projects/pamshaffermusic/metalalia-multimedia-fairytales-for-your-tablet-an,CONGRATULATIONS!!!!!,1399681310,UHJvamVjdENvbW1lbnQtNjczNzYwMw==
https://www.kickstarter.com/projects/pamshaffermusic/metalalia-multimedia-fairytales-for-your-tablet-an,If everyone put in a dollar we can meet goal!,1399648226,UHJvamVjdENvbW1lbnQtNjczMjkwMQ==
https://www.kickstarter.com/projects/pamshaffermusic/metalalia-multimedia-fairytales-for-your-tablet-an,"Thanks so much, Keith! I really like the ANF community and am delighted you found us through it. Kay, so glad that Jenna told you about it too!",1399509698,UHJvamVjdENvbW1lbnQtNjcxNjk0Mg==
https://www.kickstarter.com/projects/pamshaffermusic/metalalia-multimedia-fairytales-for-your-tablet-an,Just added my backing and tried spreading the word after I saw your post in ANF recently. It's a beautiful idea and I really hope you make it!,1399508868,UHJvamVjdENvbW1lbnQtNjcxNjc4MA==
https://www.kickstarter.com/projects/pamshaffermusic/metalalia-multimedia-fairytales-for-your-tablet-an,Wow this looks like a really exciting project. Glad Jenna pointed me at this :-),1399498352,UHJvamVjdENvbW1lbnQtNjcxNTE2Nw==
https://www.kickstarter.com/projects/pamshaffermusic/metalalia-multimedia-fairytales-for-your-tablet-an,Wahoo! Thanks Nadine! And thank you to Kickstarter for choosing us for the Staff Picks page <3,1399265222,UHJvamVjdENvbW1lbnQtNjY4OTU4MQ==
https://www.kickstarter.com/projects/pamshaffermusic/metalalia-multimedia-fairytales-for-your-tablet-an,Ya'll are on the Staff Picks page! Congrats!,1399260949,UHJvamVjdENvbW1lbnQtNjY4OTMxNg==
https://www.kickstarter.com/projects/pamshaffermusic/metalalia-multimedia-fairytales-for-your-tablet-an,you're almost there!!! keep it up!! xx,1399202290,UHJvamVjdENvbW1lbnQtNjY4NDgyNw==
https://www.kickstarter.com/projects/pamshaffermusic/metalalia-multimedia-fairytales-for-your-tablet-an,"Love it guys, can't wait to see the app when it's up and running!! Go go Metalalialialialalia!",1397226280,UHJvamVjdENvbW1lbnQtNjQ4MTY2Mw==
https://www.kickstarter.com/projects/pamshaffermusic/metalalia-multimedia-fairytales-for-your-tablet-an,"Thanks Mark! The Wind-up Boy is our most in depth story so far. We can't wait to share it. Gena, we are stoked to see how the art looks in print too!",1397032566,UHJvamVjdENvbW1lbnQtNjQ1Mzc3NQ==
https://www.kickstarter.com/projects/pamshaffermusic/metalalia-multimedia-fairytales-for-your-tablet-an,Looking forward to The Wind Up Boy. Love the idea of that one.,1397026539,UHJvamVjdENvbW1lbnQtNjQ1MzMzNA==
https://www.kickstarter.com/projects/pamshaffermusic/metalalia-multimedia-fairytales-for-your-tablet-an,Stoked for the postcards!,1396994858,UHJvamVjdENvbW1lbnQtNjQ0NzMxNw==
https://www.kickstarter.com/projects/tinstarorphans/tin-star-orphans-on-vinyl,"Couldn't have done it without you, Kevin! 
let alone you Ian! 
thanks so much, guys!",1400702864,UHJvamVjdENvbW1lbnQtNjgxNzAxNw==
https://www.kickstarter.com/projects/tinstarorphans/tin-star-orphans-on-vinyl,Way to go!!!,1400698840,UHJvamVjdENvbW1lbnQtNjgxNjQ3Ng==
https://www.kickstarter.com/projects/tinstarorphans/tin-star-orphans-on-vinyl,"Me too, Kevin. I really hoped this would be funded. I wish I could do more.",1399977020,UHJvamVjdENvbW1lbnQtNjc1ODI4Mg==
https://www.kickstarter.com/projects/tinstarorphans/tin-star-orphans-on-vinyl,"I'm going to be sad if this is not funded, I really want this on vinyl!",1399737613,UHJvamVjdENvbW1lbnQtNjc0MDg4Mw==
https://www.kickstarter.com/projects/1547614792/social-studies-a-short-film,Can't wait to see the final product. (And s/o to Gabby!),1402084563,UHJvamVjdENvbW1lbnQtNjk0NjMzMw==
https://www.kickstarter.com/projects/1547614792/social-studies-a-short-film,Sorry I couldn't give more. Much success to you!,1399558002,UHJvamVjdENvbW1lbnQtNjcyMjA3Mw==
https://www.kickstarter.com/projects/1547614792/social-studies-a-short-film,Future success to come--pay it forward.,1399143187,UHJvamVjdENvbW1lbnQtNjY4MTA3OQ==
https://www.kickstarter.com/projects/1135118975/the-purple-circle,"Thank you for your appreciation, can't wait to get this rolling!",1396996221,UHJvamVjdENvbW1lbnQtNjQ0Nzc5Ng==
https://www.kickstarter.com/projects/1135118975/the-purple-circle,Olivier & Ben - Great promo piece - Congrats for getting the project off the ground!,1396990242,UHJvamVjdENvbW1lbnQtNjQ0NTgxMA==
https://www.kickstarter.com/projects/481703930/sessions-spectrum-fantastic-art-portraits-by-greg,"Thanks to all of our supporters for helping us to try and make this book possible! We can't thank you enough!
--John and Greg",1399352790,UHJvamVjdENvbW1lbnQtNjY5ODA1NQ==
https://www.kickstarter.com/projects/481703930/sessions-spectrum-fantastic-art-portraits-by-greg,"We will post another update in a few days with the latest details.
--John",1398729847,UHJvamVjdENvbW1lbnQtNjY0MTEwNw==
https://www.kickstarter.com/projects/481703930/sessions-spectrum-fantastic-art-portraits-by-greg,Greg and I would like to welcome and thank our most recent backers that have joined us over the last few days. We appreciate all of your support! --John,1398729778,UHJvamVjdENvbW1lbnQtNjY0MTA5Ng==
https://www.kickstarter.com/projects/481703930/sessions-spectrum-fantastic-art-portraits-by-greg,Greg and I have just posted an update. Please take a look to see how we have been preparing for the show! --John,1398199352,UHJvamVjdENvbW1lbnQtNjU5MTU1MA==
https://www.kickstarter.com/projects/481703930/sessions-spectrum-fantastic-art-portraits-by-greg,"G_Q, Greg and I just so happen to have an update in the works for posting tomorrow. Stay tuned. --John",1398123902,UHJvamVjdENvbW1lbnQtNjU4MzA5MA==
https://www.kickstarter.com/projects/481703930/sessions-spectrum-fantastic-art-portraits-by-greg,I'm kinda shocked there hasn't been any updates or comments or anything on this one.,1398103090,UHJvamVjdENvbW1lbnQtNjU4MDAzNA==
https://www.kickstarter.com/projects/481703930/sessions-spectrum-fantastic-art-portraits-by-greg,"Thanks to everyone who pledged on day 1! Greg and I are supper excited to have your support!
--John",1397063389,UHJvamVjdENvbW1lbnQtNjQ1Nzg4Mw==
https://www.kickstarter.com/projects/481703930/sessions-spectrum-fantastic-art-portraits-by-greg,"@Flesk Publications: All of your books have been great, and I'll always be here right from the start.",1396981320,UHJvamVjdENvbW1lbnQtNjQ0MzQxMg==
https://www.kickstarter.com/projects/481703930/sessions-spectrum-fantastic-art-portraits-by-greg,"Welcome back, Antonio. 

I just received a good question: If the dimensions of the book increase with the stretch goals, do the dimensions of the included portraits also increase?

Answer: Yes indeed. If the book dimensions increase, the art and portrait sizes will increase also.

--John",1396980504,UHJvamVjdENvbW1lbnQtNjQ0MzIyOA==
https://www.kickstarter.com/projects/481703930/sessions-spectrum-fantastic-art-portraits-by-greg,Time to get this funded!,1396977698,UHJvamVjdENvbW1lbnQtNjQ0MjQyNw==
https://www.kickstarter.com/projects/1133366241/d-y-workshop-soft-tiles,"Awesome, Daniela! You'll get there",1397268053,UHJvamVjdENvbW1lbnQtNjQ4ODkwOQ==
https://www.kickstarter.com/projects/1133366241/d-y-workshop-soft-tiles,Cool!!! Good luck D+Y!!,1397172018,UHJvamVjdENvbW1lbnQtNjQ3NTkxNg==
https://www.kickstarter.com/projects/880381747/soundverters-enhancing-the-flat-screen-tvs-sound-w,"I have had many make the same comment as you. My own cousin who is an engineer said that he was thinking about making something two months prior to me calling him and telling him about it and my progress. 

Keep in mind they will be available soon to purchase online. Feel free to visit our site and let us know what you think. www.soundverter.com

Thanks for viewing.",1398283577,UHJvamVjdENvbW1lbnQtNjYwMTg5OA==
https://www.kickstarter.com/projects/880381747/soundverters-enhancing-the-flat-screen-tvs-sound-w,Bret I've wanted to do the same thing to my TV but up to now have been to lazy. Love your idea and wish you all the best.,1398231254,UHJvamVjdENvbW1lbnQtNjU5NTI2OQ==
https://www.kickstarter.com/projects/880381747/soundverters-enhancing-the-flat-screen-tvs-sound-w,This comment has been removed by Kickstarter.,1395526254,UHJvamVjdENvbW1lbnQtNjI2NDgwMA==
https://www.kickstarter.com/projects/753102492/on-air-the-zoo-movie,Pure io ci sono eh :) Marco mi devi una marchetta per un mio progetto su kickstarter!!! Buona Pasqua e p.... ...,1398246928,UHJvamVjdENvbW1lbnQtNjU5NjQwMg==
https://www.kickstarter.com/projects/753102492/on-air-the-zoo-movie,Bisogna pubblicizzare di più a mio avviso.,1397980040,UHJvamVjdENvbW1lbnQtNjU3MTA1Mw==
https://www.kickstarter.com/projects/753102492/on-air-the-zoo-movie,"ps... viviamo solo per il gran meastro.... e il curatore Gibba!!
ciao dal Ministro della Musica.............",1397735056,UHJvamVjdENvbW1lbnQtNjU0MzUzNw==
https://www.kickstarter.com/projects/753102492/on-air-the-zoo-movie,"aaaaooooooo siamo ancora a 3700 dollari......alò loro ci REGALANO ogni giorno tante risate e ci fanno scordare per 2 ore tutti i problemi!!! 
è il minimo donare qualcosa per far si che questo progetto si realizzi...il gruppo finelcone non contribuisce, e noi facciamogli vedere che la famiglia dello zoo spacca il culo a tutti!!!!",1397734947,UHJvamVjdENvbW1lbnQtNjU0MzUxNg==
https://www.kickstarter.com/projects/753102492/on-air-the-zoo-movie,"Ragazzi, ho appena donato! Ci vediamo all'anteprima del film! Ricordatevi di promuovere il progetto però, che il traguardo è molto lontano ed il termine vicino!",1397717069,UHJvamVjdENvbW1lbnQtNjU0MjA5NA==
https://www.kickstarter.com/projects/753102492/on-air-the-zoo-movie,"Dopo tutto quello che ci avete dato voi ""cattivi ragazzi"" questo è il minimo, vediamo se per una volta tutti gli ascoltatori si uniscono.
P.S. Ma nel film si scoprirà la differenza tra Batman ed uno svizzero?",1397710466,UHJvamVjdENvbW1lbnQtNjU0MTYzMA==
https://www.kickstarter.com/projects/753102492/on-air-the-zoo-movie,Grande Luigi! Grandi tutti! Grazie :),1397655551,UHJvamVjdENvbW1lbnQtNjUzMDIyOA==
https://www.kickstarter.com/projects/753102492/on-air-the-zoo-movie,"Finalmente sono riuscito a fare il mio contributo a sto sito, ho donato più di un pacchetto di marlboro, se riesco a diminuire, vi dono di più ogni settimana. Allo zoo avete sempre belle idee, buon lavoro!!!",1397654727,UHJvamVjdENvbW1lbnQtNjUzMDA3MA==
https://www.kickstarter.com/projects/753102492/on-air-the-zoo-movie,Non tiratevi indietro ora dai!!!!!! Basta una piccola donazione,1397651991,UHJvamVjdENvbW1lbnQtNjUyOTY1MQ==
https://www.kickstarter.com/projects/753102492/on-air-the-zoo-movie,"w lo zoo!!!!! eddai cazzo siamo milioni di ascoltatori.........basterebbe qualche euro a testa!!
Ciao a tutti dal ministro della musica, Alessio Baglioni............",1397648606,UHJvamVjdENvbW1lbnQtNjUyOTE5MA==
https://www.kickstarter.com/projects/753102492/on-air-the-zoo-movie,Grandi! :),1397591263,UHJvamVjdENvbW1lbnQtNjUyMTY5NQ==
https://www.kickstarter.com/projects/753102492/on-air-the-zoo-movie,...Ma mettete anche Santina nel film?!? UAAHHHHAAAAAHHH !!!! SIETE MITICIIIII !!!,1397591188,UHJvamVjdENvbW1lbnQtNjUyMTY3Ng==
https://www.kickstarter.com/projects/753102492/on-air-the-zoo-movie,Appena donato 30€ dai cazzo dobbiamo farcela!!!,1397577614,UHJvamVjdENvbW1lbnQtNjUxODY4Mw==
https://www.kickstarter.com/projects/753102492/on-air-the-zoo-movie,Dai ragazzi ho bisogno di vedere questo film.. Marco sei il numero 1 e Davide uguale... Grazie di tutto!!,1397565254,UHJvamVjdENvbW1lbnQtNjUxNjM1NQ==
https://www.kickstarter.com/projects/753102492/on-air-the-zoo-movie,Questo film si deve fare ! :D,1397517935,UHJvamVjdENvbW1lbnQtNjUxMTM3OQ==
https://www.kickstarter.com/projects/753102492/on-air-the-zoo-movie,Vogliamo il FILM!!! W lo Zoo!!!,1397154985,UHJvamVjdENvbW1lbnQtNjQ3Mjk1Mw==
https://www.kickstarter.com/projects/753102492/on-air-the-zoo-movie,:),1397150723,UHJvamVjdENvbW1lbnQtNjQ3MjAyNw==
https://www.kickstarter.com/projects/753102492/on-air-the-zoo-movie,...We only live for the Great Master!,1397146437,UHJvamVjdENvbW1lbnQtNjQ3MTEzNQ==
https://www.kickstarter.com/projects/dirtyoldwedge/dirty-old-wedge,Any update on when the T-Shirt/DVD will be sent to backers? Caught the film at the SDSFF...KILLER!!!,1479494505,UHJvamVjdENvbW1lbnQtMTUwNTA2OTc=
https://www.kickstarter.com/projects/dirtyoldwedge/dirty-old-wedge,Anxious to see the film...any tentative date for the premier?,1438735024,UHJvamVjdENvbW1lbnQtMTA3NzMwMTA=
https://www.kickstarter.com/projects/dirtyoldwedge/dirty-old-wedge,Any news on progress?,1428447252,UHJvamVjdENvbW1lbnQtOTU4NjExMA==
